Symbol,Name,Exchange,Tradable,Shortable,Marginable
SEIS,SEI Exchange Traded Funds SEI Select Small Cap ETF,NASDAQ,TRUE,FALSE,TRUE
ALRS,Alerus Financial Corporation Common Stock,NASDAQ,TRUE,TRUE,TRUE
CETX,Cemtrex Inc. Common Stock,NASDAQ,TRUE,FALSE,TRUE
F,Ford Motor Company,NYSE,TRUE,TRUE,TRUE
GTN,Gray Media, Inc.,NYSE,TRUE,TRUE,TRUE
SEIE,SEI Exchange Traded Funds SEI Select International Equity ETF,NASDAQ,TRUE,FALSE,TRUE
SEEM,SEI Exchange Traded Funds SEI Select Emerging Markets Equity ETF,NASDAQ,TRUE,FALSE,TRUE
EDBLW,Edible Garden AG Incorporated Warrant,NASDAQ,TRUE,FALSE,TRUE
SEED,Origin Agritech Limited Common Stock,NASDAQ,TRUE,FALSE,TRUE
GQQQ,EA Series Trust Astoria US Quality Growth Kings ETF,NASDAQ,TRUE,FALSE,TRUE
RGTIW,Rigetti Computing, Inc. Warrants,NASDAQ,TRUE,FALSE,TRUE
CEROW,CERo Therapeutics Holdings, Inc. Warrants,NASDAQ,TRUE,FALSE,TRUE
CERO,CERo Therapeutics Holdings, Inc. Common Stock,NASDAQ,TRUE,FALSE,TRUE
CEPO,Cantor Equity Partners I, Inc. Class A Ordinary Shares,NASDAQ,TRUE,FALSE,TRUE
SEAL.PRB,Seapeak LLC 8.50% Series B Fixed-to-Floating Rate Cumulative Redeemable Perpetual Preferred Units,NYSE,TRUE,FALSE,TRUE
RITM.PRC,Rithm Capital Corp. 6.375% Series C Fixed-to-Floating Rate Cumulative Redeemable Preferred Stock,NYSE,TRUE,FALSE,TRUE
EDBL,Edible Garden AG Incorporated Common Stock,NASDAQ,TRUE,FALSE,TRUE
EDAP,EDAP TMS S.A. American Depositary Shares,NASDAQ,TRUE,FALSE,TRUE
SEAL.PRA,Seapeak LLC 9.00% Series A Cumulative Redeemable Perpetual Preferred Units,NYSE,TRUE,FALSE,TRUE
ECX,ECARX Holdings Inc. Class A Ordinary shares,NASDAQ,TRUE,FALSE,TRUE
GPRK,GEOPARK LIMITED,NYSE,TRUE,FALSE,TRUE
CHE,Chemed Corporation,NYSE,TRUE,TRUE,TRUE
HUBS,HUBSPOT, INC.,NYSE,TRUE,TRUE,TRUE
ECOW,Pacer Funds Pacer Emerging Markets Cash Cows 100 ETF,NASDAQ,TRUE,FALSE,TRUE
ALB,Albemarle Corporation,NYSE,TRUE,TRUE,TRUE
SDVY,First Trust Exchange-Traded Fund VI First Trust SMID Cap Rising Dividend Achievers ETF,NASDAQ,TRUE,FALSE,TRUE
SDTY,Tidal Trust II YieldMax S&P 500 0DTE Covered Call Strategy ETF,NASDAQ,TRUE,FALSE,TRUE
GLBZ,Glen Burnie Bancorp Common Stock,NASDAQ,TRUE,TRUE,TRUE
FSBW,FS Bancorp, Inc. Common Stock,NASDAQ,TRUE,TRUE,TRUE
SDSTW,Stardust Power Inc. Warrant,NASDAQ,TRUE,FALSE,TRUE
SDST,Stardust Power Inc. Common Stock,NASDAQ,TRUE,FALSE,TRUE
CAL,Caleres Inc,NYSE,TRUE,TRUE,TRUE
SDSI,American Century ETF Trust American Century Short Duration Strategic Income ETF,NASDAQ,TRUE,FALSE,TRUE
AN,AutoNation, Inc.,NYSE,TRUE,TRUE,TRUE
FVR,FrontView REIT, Inc.,NYSE,TRUE,TRUE,TRUE
ALAB,Astera Labs, Inc. Common Stock,NASDAQ,TRUE,TRUE,TRUE
FINW,FinWise Bancorp Common Stock,NASDAQ,TRUE,TRUE,TRUE
CEP,Cantor Equity Partners, Inc. Class A Ordinary Shares,NASDAQ,TRUE,FALSE,TRUE
CENN,Cenntro Inc. Common Stock,NASDAQ,TRUE,FALSE,TRUE
AL,Air Lease Corporation,NYSE,TRUE,TRUE,TRUE
BH,Biglari Holdings Inc. Class B Common Stock,NYSE,TRUE,TRUE,TRUE
SDOT,Sadot Group Inc. Common Stock,NASDAQ,TRUE,FALSE,TRUE
GPRO,GoPro, Inc. Class A Common Stock,NASDAQ,TRUE,FALSE,TRUE
ECO,Okeanis Eco Tankers Corp.,NYSE,TRUE,FALSE,TRUE
RITM.PRD,Rithm Capital Corp. 7.00% Fixed-Rate Reset Series D Cumulative Redeemable Preferred Stock,NYSE,TRUE,FALSE,TRUE
GPRF,Goldman Sachs ETF Trust Goldman Sachs Access U.S. Preferred Stock and Hybrid Securities ETF,NASDAQ,TRUE,FALSE,TRUE
CELZ,Creative Medical Technology Holdings, Inc. Common Stock,NASDAQ,TRUE,FALSE,TRUE
GPMT.PRA,Granite Point Mortgage Trust Inc. 7.00% Series A Fixed-to-Floating Rate Cumulative Redeemable Preferred Stock,NYSE,TRUE,FALSE,TRUE
RITR,Reitar Logtech Holdings Limited Ordinary shares,NASDAQ,TRUE,FALSE,TRUE
AKRO,Akero Therapeutics, Inc. Common Stock,NASDAQ,TRUE,TRUE,TRUE
CELUW,Celularity Inc. Warrant,NASDAQ,TRUE,FALSE,TRUE
GPJA,Georgia Power Company Series 2017A 5.00 Percent Junior Subordinated Notes due October 1, 2077,NYSE,TRUE,FALSE,TRUE
AXR,AMREP Corporation,NYSE,TRUE,TRUE,TRUE
AKBA,Akebia Therapeutics, Inc. Common Stock,NASDAQ,TRUE,TRUE,TRUE
CELU,Celularity Inc. Class A Common Stock,NASDAQ,TRUE,FALSE,TRUE
SDM,Smart Digital Group Limited Ordinary Shares,NASDAQ,TRUE,FALSE,TRUE
SDHIU,Siddhi Acquisition Corp Unit,NASDAQ,TRUE,FALSE,TRUE
CELG.RT,Bristol-Myers Squibb Company Contingent Value Rights,NYSE,TRUE,FALSE,TRUE
BALY,Bally's Corporation,NYSE,TRUE,FALSE,TRUE
SDAWW,SunCar Technology Group Inc. Warrant,NASDAQ,TRUE,FALSE,TRUE
EEMA,iShares MSCI Emerging Markets Asia ETF,NASDAQ,TRUE,TRUE,TRUE
SDA,SunCar Technology Group Inc. Class A Ordinary Shares,NASDAQ,TRUE,FALSE,TRUE
COUR,Coursera, Inc.,NYSE,TRUE,TRUE,TRUE
AKAM,Akamai Technologies, Inc. Common Stock,NASDAQ,TRUE,TRUE,TRUE
SCYX,SCYNEXIS, Inc. Common Stock,NASDAQ,TRUE,FALSE,TRUE
GPIQ,Goldman Sachs ETF Trust Goldman Sachs Nasdaq-100 Premium Income ETF,NASDAQ,TRUE,FALSE,TRUE
AIT,Applied Industrial Technologies, Inc.,NYSE,TRUE,TRUE,TRUE
ATNI,ATN International, Inc. Common Stock,NASDAQ,TRUE,TRUE,TRUE
HMC,Honda Motor Co., Ltd. American Depositary Share, each representing three (3) shares of Common Stock,NYSE,TRUE,TRUE,TRUE
SCWO,374Water Inc. Common Stock,NASDAQ,TRUE,FALSE,TRUE
BKU,Bankunited, Inc.,NYSE,TRUE,TRUE,TRUE
SCNX,Scienture Holdings, Inc. Common Stock,NASDAQ,TRUE,FALSE,TRUE
SCNI,Scinai Immunotherapeutics Ltd. American Depositary Shares,NASDAQ,TRUE,FALSE,TRUE
HLX,Helix Energy Solutions Group, Inc.,NYSE,TRUE,TRUE,TRUE
GPATW,GP-Act III Acquisition Corp. Warrants,NASDAQ,TRUE,FALSE,TRUE
SCLXW,Scilex Holding Company Warrant,NASDAQ,TRUE,FALSE,TRUE
CEFA,Global X Funds Global X S&P Catholic Values Developed ex-U.S. ETF,NASDAQ,TRUE,FALSE,TRUE
SCLX,Scilex Holding Company Common Stock,NASDAQ,TRUE,FALSE,TRUE
SCKT,Socket Mobile, Inc. Common Stock,NASDAQ,TRUE,FALSE,TRUE
GLNG,Golar Lng Ltd,NASDAQ,TRUE,TRUE,TRUE
AIRR,First Trust Exchange-Traded Fund VI First Trust RBA American Industrial Renaissance ETF,NASDAQ,TRUE,TRUE,TRUE
AIRG,Airgain, Inc. Common Stock,NASDAQ,TRUE,TRUE,TRUE
SCHW.PRJ,The Charles Schwab Corporation Depositary Shares, Each Representing a 1/40th Interest in a Share of 4.450% Non-Cumulative Perpetual Preferred Stock, Series J,NYSE,TRUE,FALSE,TRUE
ECDAW,ECD Automotive Design, Inc. Warrant,NASDAQ,TRUE,FALSE,TRUE
ECDA,ECD Automotive Design, Inc. Common Stock,NASDAQ,TRUE,FALSE,TRUE
FDP,Fresh Del Monte Produce Inc.,NYSE,TRUE,TRUE,TRUE
EFXT,Enerflex Ltd.,NYSE,TRUE,TRUE,TRUE
SCE.PRL,SCE TRUST VI 5.00% Trust Preference Securities,NYSE,TRUE,FALSE,TRUE
SCE.PRK,SCE TRUST V,NYSE,TRUE,FALSE,TRUE
SCDS,J.P. Morgan Exchange-Traded Fund Trust JPMorgan Fundamental Data Science Small Core ETF,NASDAQ,TRUE,FALSE,TRUE
GPATU,GP-Act III Acquisition Corp. Units,NASDAQ,TRUE,FALSE,TRUE
DUK.PRA,Duke Energy Corporation Depositary Shares, each representing a 1/1,000th interest in a share of 5.75% Series A Cumulative Redeemable Perpetual Preferred Stock,NYSE,TRUE,TRUE,TRUE
SCD,LMP Capital and Income Fund, Inc.,NYSE,TRUE,FALSE,TRUE
DOOO,BRP Inc. Common Subordinate Voting Shares,NASDAQ,TRUE,TRUE,TRUE
AIQ,Global X Funds Global X Artificial Intelligence & Technology ETF,NASDAQ,TRUE,TRUE,TRUE
CECO,CECO Environmental Corp. Common Stock,NASDAQ,TRUE,TRUE,TRUE
CE,Celanese Corporation Common Stock,NYSE,TRUE,TRUE,TRUE
AIPI,ETF Opportunities Trust REX AI Equity Premium Income ETF,NASDAQ,TRUE,TRUE,TRUE
CDZI,CADIZ, Inc. Common Stock,NASDAQ,TRUE,TRUE,TRUE
GPAT,GP-Act III Acquisition Corp. Class A Ordinary Share,NASDAQ,TRUE,FALSE,TRUE
GP,GreenPower Motor Company Inc. Common Shares,NASDAQ,TRUE,FALSE,TRUE
CEE,The Central and Eastern Europe Fund, Inc.,NYSE,TRUE,FALSE,TRUE
GOVX,GeoVax Labs, Inc. Common Stock,NASDAQ,TRUE,FALSE,TRUE
ECCX,Eagle Point Credit Company Inc. 6.6875% Notes due 2028,NYSE,TRUE,FALSE,TRUE
CDXS,Codexis, Inc. Common Stock,NASDAQ,TRUE,TRUE,TRUE
AIP,Arteris, Inc. Common Stock,NASDAQ,TRUE,TRUE,TRUE
CDW,CDW Corporation Common Stock,NASDAQ,TRUE,TRUE,TRUE
CEADW,CEA Industries Inc. Warrant,NASDAQ,TRUE,FALSE,TRUE
CEAD,CEA Industries Inc. Common Stock,NASDAQ,TRUE,FALSE,TRUE
AIOT,PowerFleet, Inc. Common Stock,NASDAQ,TRUE,TRUE,TRUE
CDRE,Cadre Holdings, Inc.,NYSE,TRUE,TRUE,TRUE
CDZIP,Cadiz, Inc. Depositary Shares,NASDAQ,TRUE,FALSE,TRUE
GORV,Lazydays Holdings, Inc. Common Stock,NASDAQ,TRUE,FALSE,TRUE
SBXD.WS,SilverBox Corp IV Redeemable warrants, each whole warrant exercisable for one Class A Ordinary Share at an exercise price of $11.50,NYSE,TRUE,FALSE,TRUE
AIG,American International Group, Inc.,NYSE,TRUE,TRUE,TRUE
CDNS,Cadence Design Systems, Inc. Common Stock,NASDAQ,TRUE,TRUE,TRUE
CDNA,CareDx, Inc. Common Stock,NASDAQ,TRUE,TRUE,TRUE
CDLX,Cardlytics, Inc. Common Stock,NASDAQ,TRUE,TRUE,TRUE
AIA,iShares Asia 50 ETF,NASDAQ,TRUE,TRUE,TRUE
SBXD.U,SilverBox Corp IV Units, each consisting of one Class A ordinary share and one-third of one redeemable warrant,NYSE,TRUE,FALSE,TRUE
SBXD,SilverBox Corp IV,NYSE,TRUE,FALSE,TRUE
SBLK,Star Bulk Carriers Corp. Common Shares,NASDAQ,TRUE,FALSE,TRUE
AI,C3.ai, Inc.,NYSE,TRUE,TRUE,TRUE
CDE,Coeur Mining, Inc.,NYSE,TRUE,TRUE,TRUE
AHR,American Healthcare REIT, Inc.,NYSE,TRUE,TRUE,TRUE
CDTTW,Conduit Pharmaceuticals Inc. Warrant,NASDAQ,TRUE,FALSE,TRUE
SBI,Western Asset Intermediate Muni Fund, Inc.,NYSE,TRUE,FALSE,TRUE
GOODO,Gladstone Commercial Corporation 6.00% Series G Cumulative Redeemable Preferred Stock, par value $0.001 per share,NASDAQ,TRUE,FALSE,TRUE
SBFMW,Sunshine Biopharma Inc. Warrant,NASDAQ,TRUE,FALSE,TRUE
GOODN,Gladstone Commercial Corporation 6.625% Series E Cumulative Redeemable Preferred Stock,NASDAQ,TRUE,FALSE,TRUE
SBFM,Sunshine Biopharma Inc. Common Stock,NASDAQ,TRUE,FALSE,TRUE
AHH,Armada Hoffler Properties, Inc.,NYSE,TRUE,TRUE,TRUE
AHCO,AdaptHealth Corp. Common Stock,NASDAQ,TRUE,TRUE,TRUE
SMXT,Solarmax Technology Inc. Common Stock,NASDAQ,TRUE,FALSE,TRUE
BST,BlackRock Science and Technology Trust,NYSE,TRUE,TRUE,TRUE
BSCS,Invesco BulletShares 2028 Corporate Bond ETF,NASDAQ,TRUE,TRUE,TRUE
BRKL,Brookline Bancorp, Inc. Common Stock,NASDAQ,TRUE,TRUE,TRUE
CDTG,CDT Environmental Technology Investment Holdings Limited ordinary shares,NASDAQ,TRUE,FALSE,TRUE
BRK.B,BERKSHIRE HATHAWAY Class B,NYSE,TRUE,TRUE,TRUE
AGYS,Agilysys, Inc. Common Stock (DE),NASDAQ,TRUE,TRUE,TRUE
ECCW,Eagle Point Credit Company Inc .6.75% Notes due 2031,NYSE,TRUE,FALSE,TRUE
AGX,Argan, Inc,NYSE,TRUE,TRUE,TRUE
GNT.PRA,GAMCO Natural Resources, Gold & Income Trust 5.2 Percent Series A Cumulative Preferred Shares (Liquidation Preference $25.00 per share),NYSE,TRUE,FALSE,TRUE
GNT,GAMCO Natural Resources, Gold & Income Trust,NYSE,TRUE,FALSE,TRUE
CDT,Conduit Pharmaceuticals Inc. Common Stock,NASDAQ,TRUE,FALSE,TRUE
SBET,SharpLink Gaming, Inc. Common Stock,NASDAQ,TRUE,FALSE,TRUE
BRFS,BRF - Brasil Foods S.A.,NYSE,TRUE,TRUE,TRUE
CDR.PRB,CEDAR REALTY TRUST, INC. 7.25% Series B Cumulative Redeemable Preferred Stock,NYSE,TRUE,FALSE,TRUE
CDROW,Codere Online Luxembourg, S.A. Warrants,NASDAQ,TRUE,FALSE,TRUE
SBCWW,SBC Medical Group Holdings Incorporated Warrants,NASDAQ,TRUE,FALSE,TRUE
AGS,PlayAGS, Inc.,NYSE,TRUE,TRUE,TRUE
CDRO,Codere Online Luxembourg, S.A. Ordinary Shares,NASDAQ,TRUE,FALSE,TRUE
BAK,Braskem S.A. American Depositary Shares (Each representing Two Class A  Preferred Shares),NYSE,TRUE,FALSE,TRUE
BNS,Bank of Nova Scotia,NYSE,TRUE,TRUE,TRUE
ECCV,Eagle Point Credit Company Inc. 5.375% Notes due 2029,NYSE,TRUE,FALSE,TRUE
SBC,SBC Medical Group Holdings Incorporated Common Stock,NASDAQ,TRUE,FALSE,TRUE
ECCU,Eagle Point Credit Company Inc. 7.75% Notes due 2030,NYSE,TRUE,FALSE,TRUE
SB.PRD,Safe Bulkers, Inc. 8.00% Series D,NYSE,TRUE,FALSE,TRUE
SNAL,Snail, Inc. Class A Common Stock,NASDAQ,TRUE,FALSE,TRUE
AGO,Assured Guaranty, LTD,NYSE,TRUE,TRUE,TRUE
ECCF,Eagle Point Credit Company Inc. 8.00% Series F Term Preferred Stock due 2029,NYSE,TRUE,FALSE,TRUE
SB.PRC,SAFE BULKERS, INC. 8.00%  SER C,NYSE,TRUE,FALSE,TRUE
BDX,Becton, Dickinson and Co.,NYSE,TRUE,TRUE,TRUE
BAFN,BayFirst Financial Corp. Common Stock,NASDAQ,TRUE,FALSE,TRUE
AGNCN,AGNC Investment Corp. Depositary Shares Each Representing a 1/1,000th Interest in a Share of 7.00% Series C Fixed-To-Floating Rate Cumulative Redeemable Preferred Stock,NASDAQ,TRUE,TRUE,TRUE
SAZ,Saratoga Investment Corp. 8.50% Notes due 2028,NYSE,TRUE,FALSE,TRUE
SAY,Saratoga Investment Corp. 8.125% Notes due 2027,NYSE,TRUE,FALSE,TRUE
GNPX,Genprex, Inc. Common Stock,NASDAQ,TRUE,FALSE,TRUE
BDN,Brandywine Realty Trust,NYSE,TRUE,TRUE,TRUE
ECCC,Eagle Point Credit Company Inc. 6.50% Series C Term Preferred Stock due 2031,NYSE,TRUE,FALSE,TRUE
AGNC,AGNC Investment Corp. Common Stock,NASDAQ,TRUE,TRUE,TRUE
ECC.PRD,Eagle Point Credit Company Inc. 6.75% Series D Preferred Stock,NYSE,TRUE,FALSE,TRUE
AORT,Artivion, Inc.,NYSE,TRUE,TRUE,TRUE
AMAL,Amalgamated Financial Corp. Common Stock (DE),NASDAQ,TRUE,TRUE,TRUE
ALEC,Alector, Inc. Common Stock,NASDAQ,TRUE,TRUE,TRUE
GNOM,Global X Funds Global X Genomics & Biotechnology ETF,NASDAQ,TRUE,FALSE,TRUE
GNMA,iShares GNMA Bond ETF,NASDAQ,TRUE,FALSE,TRUE
ACNB,ACNB Corporation Common Stock,NASDAQ,TRUE,TRUE,TRUE
CDLR,Cadeler A/S American Depositary Share (each representing four (4) Ordinary Shares),NYSE,TRUE,FALSE,TRUE
SAVA,Cassava Sciences, Inc. Common Stock,NASDAQ,TRUE,FALSE,TRUE
AGIO,Agios Pharmaceuticals, Inc. Common Stock,NASDAQ,TRUE,TRUE,TRUE
AGI,Alamos Gold Inc. Class A Common Shares,NYSE,TRUE,TRUE,TRUE
BAFE,The Advisors' Inner Circle Fund III Brown Advisory Flexible Equity ETF,NASDAQ,TRUE,FALSE,TRUE
GNLX,Genelux Corporation Common Stock,NASDAQ,TRUE,FALSE,TRUE
AGEN,Agenus Inc. Common Stock,NASDAQ,TRUE,TRUE,TRUE
AGCO,AGCO Corporation,NYSE,TRUE,TRUE,TRUE
SATLW,Satellogic Inc. Warrant,NASDAQ,TRUE,FALSE,TRUE
GOGO,Gogo Inc. Common Stock,NASDAQ,TRUE,TRUE,TRUE
CDL,VictoryShares US Large Cap High Div Volatility Wtd ETF,NASDAQ,TRUE,FALSE,TRUE
AGAE,Allied Gaming & Entertainment Inc. Common Stock,NASDAQ,TRUE,TRUE,TRUE
SATL,Satellogic Inc. Class A Common Stock,NASDAQ,TRUE,FALSE,TRUE
SAT,Saratoga Investment Corp. 6.00% Notes due 2027,NYSE,TRUE,FALSE,TRUE
AG,FIRST MAJESTIC SILVER CORP,NYSE,TRUE,TRUE,TRUE
AFYA,Afya Limited Class A Common Shares,NASDAQ,TRUE,TRUE,TRUE
SANW,S&W Seed Company Common Stock (NV),NASDAQ,TRUE,FALSE,TRUE
SANA,Sana Biotechnology, Inc. Common Stock,NASDAQ,TRUE,FALSE,TRUE
FPI,Farmland Partners Inc.,NYSE,TRUE,TRUE,TRUE
GNLN,Greenlane Holdings, Inc. Class A Common Stock,NASDAQ,TRUE,FALSE,TRUE
EMXC,iShares, Inc. iShares MSCI Emerging Markets ex China ETF,NASDAQ,TRUE,TRUE,TRUE
BCE,BCE, Inc.,NYSE,TRUE,TRUE,TRUE
SAJ,Saratoga Investment Corp. 8.00% Notes due 2027,NYSE,TRUE,FALSE,TRUE
AFRM,Affirm Holdings, Inc. Class A Common Stock,NASDAQ,TRUE,TRUE,TRUE
SAIH,SAIHEAT Limited Class A Ordinary Shares,NASDAQ,TRUE,FALSE,TRUE
CDIOW,Cardio Diagnostics Holdings Inc. Warrant,NASDAQ,TRUE,FALSE,TRUE
BAH,Booz Allen Hamilton Holding Corporation,NYSE,TRUE,TRUE,TRUE
CHH,Choice Hotels Intnl.,NYSE,TRUE,TRUE,TRUE
AFL,Aflac Inc.,NYSE,TRUE,TRUE,TRUE
CSCI,COSCIENS Biopharma Inc. Common Stock,NASDAQ,TRUE,TRUE,TRUE
GMS,GMS Inc.,NYSE,TRUE,TRUE,TRUE
GBLI,Global Indemnity Group, LLC,NYSE,TRUE,TRUE,TRUE
AFG,American Financial Group, Inc.,NYSE,TRUE,TRUE,TRUE
GNL.PRE,Global Net Lease, Inc. 7.375% Series E Cumulative Redeemable Perpetual Preferred Stock,NYSE,TRUE,FALSE,TRUE
SABS,SAB Biotherapeutics, Inc. Common Stock,NASDAQ,TRUE,FALSE,TRUE
SABA,Saba Capital Income & Opportunities Fund II,NYSE,TRUE,FALSE,TRUE
ECAT,BlackRock ESG Capital Allocation Term Trust,NYSE,TRUE,FALSE,TRUE
GNL.PRB,Global Net Lease, Inc. 6.875% Series B Cumulative Redeemable Perpetual Preferred Stock,NYSE,TRUE,FALSE,TRUE
GNL.PRA,Global Net Lease, Inc. 7.25% Series A Cumulative Redeemable Preferred Stock, $0.01 par value per share,NYSE,TRUE,FALSE,TRUE
GNFT,GENFIT S.A. American Depositary Shares,NASDAQ,TRUE,FALSE,TRUE
CDIO,Cardio Diagnostics Holdings Inc. Common stock,NASDAQ,TRUE,FALSE,TRUE
AFCG,Advanced Flower Capital Inc. Common Stock,NASDAQ,TRUE,TRUE,TRUE
RZLVW,Rezolve AI PLC Warrants,NASDAQ,TRUE,FALSE,TRUE
BAERW,Bridger Aerospace Group Holdings, Inc. Warrant,NASDAQ,TRUE,FALSE,TRUE
RZLV,Rezolve AI PLC Ordinary Shares,NASDAQ,TRUE,FALSE,TRUE
EBON,Ebang International Holdings Inc. Class A Ordinary Shares,NASDAQ,TRUE,FALSE,TRUE
AFBI,Affinity Bancshares, Inc. Common Stock (MD),NASDAQ,TRUE,TRUE,TRUE
EBIZ,Global X Funds Global X E-commerce ETF,NASDAQ,TRUE,FALSE,TRUE
EBI,The RBB Fund Trust Longview Advantage ETF,NASDAQ,TRUE,FALSE,TRUE
AEYE,AudioEye, Inc. Common Stock,NASDAQ,TRUE,TRUE,TRUE
GMRE.PRA,Global Medical REIT Inc. Series A Cumulative Redeemable Preferred Stock,NYSE,TRUE,FALSE,TRUE
RZC,Reinsurance Group of America, Incorporated 7.125% Fixed-Rate Reset Subordinated Debentures due 2052,NYSE,TRUE,FALSE,TRUE
EB,Eventbrite, Inc. Class A Common Stock,NYSE,TRUE,FALSE,TRUE
BANC,Banc of California, Inc.,NYSE,TRUE,TRUE,TRUE
BAER,Bridger Aerospace Group Holdings, Inc. Common Stock,NASDAQ,TRUE,FALSE,TRUE
AEVA,Aeva Technologies, Inc. Common Stock,NASDAQ,TRUE,TRUE,TRUE
AES,AES Corporation,NYSE,TRUE,TRUE,TRUE
ICLR,ICON plc Ordinary Shares,NASDAQ,TRUE,TRUE,TRUE
RZB,Reinsurance Group of America, Incorporated 5.75% Fixed-To-Floating Rate Subordinated Debentures due 2056,NYSE,TRUE,FALSE,TRUE
ICLN,iShares Global Clean Energy ETF,NASDAQ,TRUE,TRUE,TRUE
AER,Aercap Holdings N.V.,NYSE,TRUE,TRUE,TRUE
ICHR,Ichor Holdings Ordinary Shares,NASDAQ,TRUE,TRUE,TRUE
ICFI,ICF International, Inc. Common Stock,NASDAQ,TRUE,TRUE,TRUE
RXRX,Recursion Pharmaceuticals, Inc. Class A Common Stock,NASDAQ,TRUE,FALSE,TRUE
CDC,VictoryShares US EQ Income Enhanced Volatility Wtd ETF,NASDAQ,TRUE,FALSE,TRUE
AEP,American Electric Power Company, Inc. Common Stock,NASDAQ,TRUE,TRUE,TRUE
AEO,American Eagle Outfitters,NYSE,TRUE,TRUE,TRUE
GMM,Global Mofy AI Limited Class A Ordinary Shares,NASDAQ,TRUE,FALSE,TRUE
GMHS,Gamehaus Holdings Inc. Class A Ordinary Shares,NASDAQ,TRUE,FALSE,TRUE
AEM,Agnico Eagle Mines Ltd.,NYSE,TRUE,TRUE,TRUE
AEG,Aegon Ltd.,NYSE,TRUE,TRUE,TRUE
ICE,Intercontinental Exchange  Inc.,NYSE,TRUE,TRUE,TRUE
AEFC,Aegon Funding Company LLC 5.10% Subordinated Notes due 2049,NYSE,TRUE,TRUE,TRUE
RWTP,Redwood Trust, Inc. 9.125% Senior Notes Due 2030,NYSE,TRUE,FALSE,TRUE
IBTI,iShares Trust iShares iBonds Dec 2028 Term Treasury ETF,NASDAQ,TRUE,TRUE,TRUE
CCZ,Comcast Holdings Corp. 2.0% Exchangeable Subordinated Debentures due October 15, 2029 (ZONES),NYSE,TRUE,FALSE,TRUE
RWTO,Redwood Trust, Inc. 9.00% Senior Notes Due 2029,NYSE,TRUE,FALSE,TRUE
CCTG,CCSC Technology International Holdings Limited Class A Ordinary Shares,NASDAQ,TRUE,FALSE,TRUE
RWTN,Redwood Trust, Inc. 9.125% Senior Notes Due 2029,NYSE,TRUE,FALSE,TRUE
RWT.PRA,Redwood Trust, Inc. 10.00% Series A Fixed-Rate Reset Cumulative Redeemable Preferred Stock,NYSE,TRUE,FALSE,TRUE
RWAYZ,Runway Growth Finance Corp. 8.00% Notes due 2027,NASDAQ,TRUE,FALSE,TRUE
IBTG,iShares Trust iShares iBonds Dec 2026 Term Treasury ETF,NASDAQ,TRUE,TRUE,TRUE
IBTF,iShares Trust iShares iBonds Dec 2025 Term Treasury ETF,NASDAQ,TRUE,TRUE,TRUE
CCSO,Tidal ETF Trust II Carbon Collective Climate Solutions U.S. Equity ETF,NASDAQ,TRUE,FALSE,TRUE
AEE,Ameren Corporation,NYSE,TRUE,TRUE,TRUE
RVYL,Ryvyl Inc. Common Stock,NASDAQ,TRUE,FALSE,TRUE
BACQU,Bleichroeder Acquisition Corp. I Unit,NASDAQ,TRUE,FALSE,TRUE
IBTA,Ibotta, Inc.,NYSE,TRUE,TRUE,TRUE
RVSNW,Rail Vision Ltd. Warrant,NASDAQ,TRUE,FALSE,TRUE
RVSN,Rail Vision Ltd. Ordinary Share,NASDAQ,TRUE,FALSE,TRUE
IBP,INSTALLED BUILDING PRODUCTS, INC.,NYSE,TRUE,TRUE,TRUE
RVPHW,Reviva Pharmaceuticals Holdings, Inc. Warrants,NASDAQ,TRUE,FALSE,TRUE
ADX,Adams Diversified Equity Fund, Inc,NYSE,TRUE,TRUE,TRUE
ADVM,Adverum Biotechnologies, Inc. Common Stock,NASDAQ,TRUE,TRUE,TRUE
BACQR,Bleichroeder Acquisition Corp. I Right,NASDAQ,TRUE,FALSE,TRUE
SYBX,Synlogic, Inc. Common Stock,NASDAQ,TRUE,FALSE,TRUE
IBN,ICICI Bank Limited,NYSE,TRUE,TRUE,TRUE
BACQ,Bleichroeder Acquisition Corp. I Class A Ordinary Shares,NASDAQ,TRUE,FALSE,TRUE
RVPH,Reviva Pharmaceuticals Holdings, Inc. Common Stock,NASDAQ,TRUE,FALSE,TRUE
IBM,International Business Machines Corporation,NYSE,TRUE,TRUE,TRUE
RVNL,GraniteShares ETF Trust GraniteShares 2x Long RIVN Daily ETF,NASDAQ,TRUE,FALSE,TRUE
CCNR,Financial Investors Trust ALPS/CoreCommodity Natural Resources ETF,NASDAQ,TRUE,FALSE,TRUE
RVMDW,Revolution Medicines, Inc. Warrant,NASDAQ,TRUE,FALSE,TRUE
RUSC,Russell Investments Exchange Traded Funds US Small Cap Equity Active ETF,NASDAQ,TRUE,FALSE,TRUE
RUNN,Strategic Trust Running Oak Efficient Growth ETF,NASDAQ,TRUE,FALSE,TRUE
ADV,Advantage Solutions Inc. Class A Common Stock,NASDAQ,TRUE,TRUE,TRUE
ADTN,ADTRAN Holdings, Inc. Common Stock,NASDAQ,TRUE,TRUE,TRUE
IBKR,Interactive Brokers Group, Inc. Class A Common Stock,NASDAQ,TRUE,TRUE,TRUE
RUMBW,Rumble Inc. Warrant,NASDAQ,TRUE,FALSE,TRUE
ADT,ADT Inc.,NYSE,TRUE,TRUE,TRUE
CCNEP,CNB Financial Corporation Depositary Shares, each representing a 1/40th ownership interest in a share of 7.125% Series A Fixed-Rate Non-Cumulative Perpetual Preferred Stock,NASDAQ,TRUE,FALSE,TRUE
IBEX,IBEX Limited Common Shares,NASDAQ,TRUE,TRUE,TRUE
ADSK,Autodesk, Inc. Common Stock,NASDAQ,TRUE,TRUE,TRUE
RTH,VanEck Retail ETF,NASDAQ,TRUE,FALSE,TRUE
ADPT,Adaptive Biotechnologies Corporation Common Stock,NASDAQ,TRUE,TRUE,TRUE
RTACU,Renatus Tactical Acquisition Corp I Unit,NASDAQ,TRUE,FALSE,TRUE
RSVRW,Reservoir Media, Inc. Warrant,NASDAQ,TRUE,FALSE,TRUE
ADP,Automatic Data Processing, Inc. Common Stock,NASDAQ,TRUE,TRUE,TRUE
BAC.PRM,Bank of America Corporation Depositary Shares, each representing a 1/1,000th interest in a share of 5.375% Non-Cumulative Preferred Stock, Series KK,NYSE,TRUE,FALSE,TRUE
CCM,Concord Medical Services Holding Limited,NYSE,TRUE,FALSE,TRUE
IBB,iShares Biotechnology ETF,NASDAQ,TRUE,TRUE,TRUE
BAC.PRE,Bank of America Corporation Depositary Shares (representing 1/1,000th of a share of Floating Rate Non-Cumalative Preferred Stock, Series E),NYSE,TRUE,FALSE,TRUE
CCLDO,CareCloud, Inc. 8.75% Series B Cumulative Redeemable Perpetual Preferred Stock,NASDAQ,TRUE,FALSE,TRUE
GLYC,GlycoMimetics, Inc. Common Stock,NASDAQ,TRUE,FALSE,TRUE
BAC.PRB,Bank of America Corporation Depositary Shares, each representing a 1/1,000th interest in a share of 6.000% Non-Cumulative Preferred Stock, Series GG,NYSE,TRUE,FALSE,TRUE
ADNT,Adient plc Ordinary Shares,NYSE,TRUE,TRUE,TRUE
RSF,RiverNorth Capital and Income Fund, Inc.,NYSE,TRUE,FALSE,TRUE
GLXG,Galaxy Payroll Group Limited Class A Ordinary Shares,NASDAQ,TRUE,FALSE,TRUE
GLTO,Galecto, Inc. Common Stock,NASDAQ,TRUE,FALSE,TRUE
GLSI,Greenwich LifeSciences, Inc. Common Stock,NASDAQ,TRUE,FALSE,TRUE
ADMA,ADMA Biologics Inc Common Stock,NASDAQ,TRUE,TRUE,TRUE
EAI,Entergy Arkansas, LLC First Mortgage Bonds, 4.875% Series due September 1, 2066,NYSE,TRUE,FALSE,TRUE
GLP,Global Partners LP,NYSE,TRUE,FALSE,TRUE
RR,Richtech Robotics Inc. Class B Common Stock,NASDAQ,TRUE,FALSE,TRUE
RPT.PRC,Rithm Property Trust Inc. 9.875% Series C Fixed-to-Floating Rate Cumulative Redeemable Preferred Stock,NYSE,TRUE,FALSE,TRUE
CCLD,CareCloud, Inc. Common Stock,NASDAQ,TRUE,FALSE,TRUE
BA.PRA,The Boeing Company Depositary Shares, each representing a 1/20th interest in a share of 6.00% Series A Mandatory Convertible Preferred Stock, par value $1.00,NYSE,TRUE,FALSE,TRUE
GLOW,Victory Portfolios II VictoryShares WestEnd Global Equity ETF,NASDAQ,TRUE,FALSE,TRUE
IAS,Integral Ad Science Holding Corp. Common Stock,NASDAQ,TRUE,TRUE,TRUE
ADM,Archer Daniels Midland Company,NYSE,TRUE,TRUE,TRUE
CCIXW,Churchill Capital Corp IX Warrant,NASDAQ,TRUE,FALSE,TRUE
CCIXU,Churchill Capital Corp IX Unit,NASDAQ,TRUE,FALSE,TRUE
GLOP.PRC,GasLog Partners LP 8.500% Series C Cumulative Redeemable Perpetual Fixed to Floating Rate Preference Units,NYSE,TRUE,FALSE,TRUE
GLOP.PRB,GasLog Partners LP 8.200% Series B Cumulative Redeemable Perpetual Fixed to Floating Rate Preference Units,NYSE,TRUE,FALSE,TRUE
GLOP.PRA,GasLog Partners LP 8.625% Series A Cumulative Redeemable Perpetual Fixed to Floating Rate Preference Units,NYSE,TRUE,FALSE,TRUE
ROMA,Roma Green Finance Limited Ordinary Shares,NASDAQ,TRUE,FALSE,TRUE
CCIX,Churchill Capital Corp IX Ordinary Shares,NASDAQ,TRUE,FALSE,TRUE
ADI,Analog Devices, Inc. Common Stock,NASDAQ,TRUE,TRUE,TRUE
ROE,EA Series Trust Astoria US Equal Weight Quality Kings ETF,NASDAQ,TRUE,FALSE,TRUE
GLMD,Galmed Pharmaceuticals Ltd. Ordinary Shares,NASDAQ,TRUE,FALSE,TRUE
IART,Integra LifeSciences Holdings Corporation Common Stock,NASDAQ,TRUE,TRUE,TRUE
IAG,IAMGold Corporation,NYSE,TRUE,TRUE,TRUE
DYTA,The RBB Fund, Inc. SGI Dynamic Tactical ETF,NASDAQ,TRUE,FALSE,TRUE
USOY,Tidal Trust II Defiance Oil Enhanced Options Income ETF,NASDAQ,TRUE,FALSE,TRUE
RNXT,RenovoRx, Inc. Common Stock,NASDAQ,TRUE,FALSE,TRUE
RNWWW,ReNew Energy Global plc Warrant,NASDAQ,TRUE,FALSE,TRUE
ADEA,Adeia Inc. Common Stock,NASDAQ,TRUE,TRUE,TRUE
RNTX,Rein Therapeutics, Inc. Common Stock,NASDAQ,TRUE,FALSE,TRUE
IAC,IAC Inc. Common Stock,NASDAQ,TRUE,TRUE,TRUE
DYNXW,Dynamix Corporation Warrant,NASDAQ,TRUE,FALSE,TRUE
DYNXU,Dynamix Corporation Unit,NASDAQ,TRUE,FALSE,TRUE
HZO,MarineMax, Inc.,NYSE,TRUE,TRUE,TRUE
RNRG,Global X Funds Global X Renewable Energy Producers ETF,NASDAQ,TRUE,FALSE,TRUE
HYZD,WisdomTree Trust WisdomTree Interest Rate Hedged High Yield Bond Fund,NASDAQ,TRUE,TRUE,TRUE
RNIN,EA Series Trust Bushido Capital US SMID Cap Equity ETF,NASDAQ,TRUE,FALSE,TRUE
RNEW,VanEck ETF Trust VanEck Green Infrastructure ETF,NASDAQ,TRUE,FALSE,TRUE
ADC,Agree Realty Corporation,NYSE,TRUE,TRUE,TRUE
ADBE,Adobe Inc. Common Stock,NASDAQ,TRUE,TRUE,TRUE
CCIRW,Cohen Circle Acquisition Corp. I Warrant,NASDAQ,TRUE,FALSE,TRUE
HYLS,First Trust Exchange-Traded Fund IV First Trust Tactical High Yield ETF,NASDAQ,TRUE,TRUE,TRUE
RNAZ,TransCode Therapeutics, Inc. Common Stock,NASDAQ,TRUE,FALSE,TRUE
RNAC,Cartesian Therapeutics, Inc. Common Stock,NASDAQ,TRUE,FALSE,TRUE
CCIRU,Cohen Circle Acquisition Corp. I Unit,NASDAQ,TRUE,FALSE,TRUE
GLE,Global Engine Group Holding Limited Class A Ordinary Shares,NASDAQ,TRUE,FALSE,TRUE
RMTI,Rockwell Medical, Inc. Common Stock,NASDAQ,TRUE,FALSE,TRUE
RMSGW,Real Messenger Corporation Warrants,NASDAQ,TRUE,FALSE,TRUE
RMSG,Real Messenger Corporation Ordinary Shares,NASDAQ,TRUE,FALSE,TRUE
CCIR,Cohen Circle Acquisition Corp. I Class A Ordinary Shares,NASDAQ,TRUE,FALSE,TRUE
CCIF,Carlyle Credit Income Fund Shares of Beneficial Interest,NYSE,TRUE,FALSE,TRUE
