Symbol,Name,Exchange,Tradable,Shortable,Marginable
KALA,KALA BIO, Inc. Common Stock,NASDAQ,TRUE,FALSE,TRUE
HSON,Hudson Global, Inc. Common Stock,NASDAQ,TRUE,FALSE,TRUE
WWD,Woodward, Inc. Common Stock,NASDAQ,TRUE,TRUE,TRUE
YMAB,Y-mAbs Therapeutics, Inc. Common Stock,NASDAQ,TRUE,TRUE,TRUE
JZXN,Jiuzi Holdings, Inc. Ordinary Shares,NASDAQ,TRUE,FALSE,TRUE
XPEL,XPEL, Inc. Common Stock,NASDAQ,TRUE,TRUE,TRUE
XNCR,Xencor, Inc. Common Stock,NASDAQ,TRUE,TRUE,TRUE
XBIT,XBiotech Inc. Common Stock,NASDAQ,TRUE,TRUE,TRUE
WRLD,World Acceptance Corporation Common Stock,NASDAQ,TRUE,TRUE,TRUE
WMK,Weis Markets, Inc.,NYSE,TRUE,TRUE,TRUE
WLFC,Willis Lease Finance Corporation Common Stock,NASDAQ,TRUE,TRUE,TRUE
WINA,Winmark Corporation Common Stock,NASDAQ,TRUE,TRUE,TRUE
WASH,Washington Trust Bancorp, Inc. Common Stock,NASDAQ,TRUE,TRUE,TRUE
WAFD,WaFd, Inc. Common Stock,NASDAQ,TRUE,TRUE,TRUE
VTOL,Bristow Group Inc.,NYSE,TRUE,TRUE,TRUE
VTMX,Corporacion Inmobiliaria Vesta, S.A.B de C.V. American Depositary Shares each representing ten (10) Common Shares,NYSE,TRUE,TRUE,TRUE
VRE,Veris Residential, Inc.,NYSE,TRUE,TRUE,TRUE
VRA,Vera Bradley, Inc. Common Stock,NASDAQ,TRUE,TRUE,TRUE
VMI,Valmont Industries, Inc.,NYSE,TRUE,TRUE,TRUE
VERA,Vera Therapeutics, Inc. Class A Common Stock,NASDAQ,TRUE,TRUE,TRUE
VEL,Velocity Financial, Inc.,NYSE,TRUE,TRUE,TRUE
VCEL,Vericel Corporation Common Stock,NASDAQ,TRUE,TRUE,TRUE
VC,Visteon Corporation Common Stock,NASDAQ,TRUE,TRUE,TRUE
BXMX,NUVEEN S&P BUY-WRITE INCOME FUND,NYSE,TRUE,TRUE,TRUE
VALU,Value Line, Inc. Common Stock,NASDAQ,TRUE,TRUE,TRUE
UVSP,Univest Financial Corporation Common Stock,NASDAQ,TRUE,TRUE,TRUE
GOOS,Canada Goose Holdings Inc.,NYSE,TRUE,FALSE,TRUE
UTMD,Utah Medical Products Inc. Common Stock,NASDAQ,TRUE,TRUE,TRUE
GDS,GDS Holdings Limited ADS,NASDAQ,TRUE,FALSE,TRUE
FFBC,First Financial Bancorp. Common Stock,NASDAQ,TRUE,FALSE,TRUE
USPH,US Physical Therapy Inc,NYSE,TRUE,TRUE,TRUE
USNA,USANA Health Sciences Inc,NYSE,TRUE,TRUE,TRUE
USM,United States Cellular Corporation,NYSE,TRUE,TRUE,TRUE
UNF,Unifirst Corp,NYSE,TRUE,TRUE,TRUE
ULH,Universal Logistics Holdings, Inc. Common Stock,NASDAQ,TRUE,TRUE,TRUE
UFPT,UFP Technologies, Inc. Common Stock,NASDAQ,TRUE,TRUE,TRUE
UEIC,Universal Electronics Inc. Common Stock,NASDAQ,TRUE,TRUE,TRUE
UE,UBRAN EDGE PROPERTIES,NYSE,TRUE,TRUE,TRUE
TYRA,Tyra Biosciences, Inc. Common Stock,NASDAQ,TRUE,TRUE,TRUE
TWIN,Twin Disc, Incorporated Common Stock,NASDAQ,TRUE,TRUE,TRUE
TTSH,Tile Shop Holdings, Inc. Common Stock,NASDAQ,TRUE,TRUE,TRUE
TRS,TriMas Corporation Common Stock,NASDAQ,TRUE,TRUE,TRUE
TRN,Trinity Industries, Inc.,NYSE,TRUE,TRUE,TRUE
TRMK,Trustmark Corporation Common Stock,NASDAQ,TRUE,TRUE,TRUE
BXMT,Blackstone Mortgage Trust, Inc. (NEW),NYSE,TRUE,TRUE,TRUE
TNC,TENNANT COMPANY,NYSE,TRUE,TRUE,TRUE
YSG,Yatsen Holding Limited American Depositary Shares each representing twenty (20) Class A Ordinary Shares,NYSE,TRUE,TRUE,TRUE
FFA,First Trust Enhanced Equity Income Fund.,NYSE,TRUE,FALSE,TRUE
XOVR,EntrepreneurShares Series Trust ERShares Private-Public Crossover ETF,NASDAQ,TRUE,TRUE,TRUE
WOW,WideOpenWest, Inc. Common Stock,NYSE,TRUE,TRUE,TRUE
WFC.PRZ,Wells Fargo & Company Depositary Shares each representing a 1/1,000th interest in a share of Non-Cumulative Perpetual Class A Preferred Stock, Series Z,NYSE,TRUE,TRUE,TRUE
VTWV,Vanguard Scottsdale Funds Vanguard Russell 2000 Value ETF,NASDAQ,TRUE,TRUE,TRUE
EVEX.WS,Eve Holding, Inc. Warrants each exercisable for one share of Common Stock at an exercise price of $11.50 per share,NYSE,TRUE,FALSE,TRUE
VABK,Virginia National Bankshares Corporation Common Stock,NASDAQ,TRUE,TRUE,TRUE
UVE,UNIVERSAL INSURANCE HLDG, INC.,NYSE,TRUE,TRUE,TRUE
UBCP,United Bancorp, Inc. Common Stock,NASDAQ,TRUE,TRUE,TRUE
TWN,Taiwan Fund, Inc.,NYSE,TRUE,TRUE,TRUE
TVRD,Tvardi Therapeutics, Inc. Common Stock,NASDAQ,TRUE,TRUE,TRUE
TSI,TCW Strategic Income Fund, Inc.,NYSE,TRUE,TRUE,TRUE
TPR,Tapestry, Inc. Common Stock,NYSE,TRUE,TRUE,TRUE
TPB,Turning Point Brands, Inc.,NYSE,TRUE,TRUE,TRUE
ULCC,Frontier Group Holdings, Inc. Common Stock,NASDAQ,TRUE,TRUE,TRUE
UBS,UBS Group AG,NYSE,TRUE,TRUE,TRUE
TOL,Toll Brothers, Inc.,NYSE,TRUE,TRUE,TRUE
VOXR,Vox Royalty Corp. Common Stock,NASDAQ,TRUE,TRUE,TRUE
ZIP,ZipRecruiter, Inc.,NYSE,TRUE,TRUE,TRUE
XHR,Xenia Hotels & Resorts, Inc.,NYSE,TRUE,TRUE,TRUE
VYGR,Voyager Therapeutics, Inc. Common Stock,NASDAQ,TRUE,TRUE,TRUE
TYL,Tyler Technologies, Inc.,NYSE,TRUE,TRUE,TRUE
TS,Tenaris S. A.,NYSE,TRUE,TRUE,TRUE
BEPH,Brookfield BRP Holdings (Canada) Inc. 4.625% Perpetual Subordinated Notes,NYSE,TRUE,FALSE,TRUE
WIX,Wix.com Ltd. Ordinary Shares,NASDAQ,TRUE,TRUE,TRUE
JYD,Jayud Global Logistics Limited Class A Ordinary Shares,NASDAQ,TRUE,FALSE,TRUE
U,Unity Software Inc.,NYSE,TRUE,TRUE,TRUE
FCBC,First Community Bankshares, Inc. (VA) Common Stock,NASDAQ,TRUE,FALSE,TRUE
ZEUS,Olympic Steel, Inc. Common Stock,NASDAQ,TRUE,TRUE,TRUE
UTWO,The RBB Fund, Inc. US Treasury 2 Year Note ETF,NASDAQ,TRUE,FALSE,TRUE
UCL,uCloudlink Group Inc. American Depositary Shares,NASDAQ,TRUE,FALSE,TRUE
UBRL,GraniteShares ETF Trust GraniteShares 2x Long UBER Daily ETF,NASDAQ,TRUE,FALSE,TRUE
UBFO,United Security Bancshares Common Stock,NASDAQ,TRUE,FALSE,TRUE
XFIX,The RBB Fund, Inc. F/m Opportunistic Income ETF,NASDAQ,TRUE,FALSE,TRUE
WLDSW,Wearable Devices Ltd. Warrant,NASDAQ,TRUE,FALSE,TRUE
TTNP,Titan Pharmaceuticals, Inc. Common Stock,NASDAQ,TRUE,FALSE,TRUE
TOYO,TOYO Co., Ltd Ordinary Shares,NASDAQ,TRUE,FALSE,TRUE
COLAU,Columbus Acquisition Corp Unit,NASDAQ,TRUE,FALSE,TRUE
TNONW,Tenon Medical, Inc. Warrant,NASDAQ,TRUE,FALSE,TRUE
JXN.PRA,Jackson Financial Inc. Depositary Shares, each representing a 1/1,000th interest in a share of Fixed-Rate Reset Noncumulative Perpetual Preferred Stock, Series A,NYSE,TRUE,FALSE,TRUE
WSO.B,Watsco, Inc. Class B,NYSE,TRUE,FALSE,TRUE
TSMU,GraniteShares ETF Trust GraniteShares 2x Long TSM Daily ETF,NASDAQ,TRUE,FALSE,TRUE
JXG,JX Luxventure Group Inc. Common Stock,NASDAQ,TRUE,FALSE,TRUE
ZIONP,Zions Bancorporation, N.A. Depositary Shares (Each representing 1/40th Interest in a Share of Series A Floating-Rate Non-Cumulative Perpetual Preferred Stock),NASDAQ,TRUE,FALSE,TRUE
BEP.PRA,Brookfield Renewable Partners L.P. 5.25% Class A Preferred Limited Partnership Units, Series 17,NYSE,TRUE,FALSE,TRUE
BX,Blackstone Inc.,NYSE,TRUE,TRUE,TRUE
XWEL,XWELL, Inc. Common Stock,NASDAQ,TRUE,FALSE,TRUE
WLAC,Willow Lane Acquisition Corp. Class A Ordinary Shares,NASDAQ,TRUE,FALSE,TRUE
JWEL,Jowell Global Ltd. Ordinary Shares,NASDAQ,TRUE,FALSE,TRUE
USEA,United Maritime Corporation Common Stock,NASDAQ,TRUE,FALSE,TRUE
JVSA,JV SPAC Acquisition Corp. Class A Ordinary Share,NASDAQ,TRUE,FALSE,TRUE
WAFDP,WaFd, Inc. Depositary Shares,NASDAQ,TRUE,FALSE,TRUE
EVEX,Eve Holding, Inc.,NYSE,TRUE,FALSE,TRUE
ZVIA,Zevia PBC,NYSE,TRUE,FALSE,TRUE
XT,iShares Exponential Technologies ETF,NASDAQ,TRUE,FALSE,TRUE
WHWK,Whitehawk Therapeutics, Inc. Common Stock,NASDAQ,TRUE,FALSE,TRUE
WD,Walker & Dunlop, Inc.,NYSE,TRUE,FALSE,TRUE
WCLD,WisdomTree Trust WisdomTree Cloud Computing Fund,NASDAQ,TRUE,FALSE,TRUE
VTWG,Vanguard Scottsdale Funds Vanguard Russell 2000 Growth ETF,NASDAQ,TRUE,FALSE,TRUE
ENDW,EA Series Trust Cambria Endowment Style ETF,NASDAQ,TRUE,FALSE,TRUE
BWXT,BWX Technologies, Inc.,NYSE,TRUE,TRUE,TRUE
VSDA,Victory Portfolios II VictoryShares Dividend Accelerator ETF,NASDAQ,TRUE,FALSE,TRUE
VLGEA,Village Super Market, Inc. Class A Common Stock,NASDAQ,TRUE,FALSE,TRUE
BWMX,Betterware de Mexico, S.A.P.I. de C.V.,NYSE,TRUE,TRUE,TRUE
VINP,Vinci Partners Investments Ltd. Class A Common Shares,NASDAQ,TRUE,FALSE,TRUE
APRE,Aprea Therapeutics, Inc. Common stock,NASDAQ,TRUE,FALSE,TRUE
JVA,Coffee Holding Co., Inc. Common Stock,NASDAQ,TRUE,FALSE,TRUE
VBNK,VersaBank Common Shares,NASDAQ,TRUE,FALSE,TRUE
TUYA,Tuya Inc. American Depositary Shares, each representing one Class A Ordinary Share,NYSE,TRUE,FALSE,TRUE
TPYP,Tortoise North American Pipeline Fund,NYSE,TRUE,FALSE,TRUE
UPB,Upstream Bio, Inc. Common Stock,NASDAQ,TRUE,FALSE,TRUE
USCB,USCB Financial Holdings, Inc. Class A Common Stock,NASDAQ,TRUE,FALSE,TRUE
UNTY,Unity Bancorp, Inc. Common Stock,NASDAQ,TRUE,FALSE,TRUE
YB,Yuanbao Inc. American Depositary Shares,NASDAQ,TRUE,FALSE,TRUE
ZTRE,The RBB Fund, Inc. F/m 3-Year Investment Grade Corporate Bond ETF,NASDAQ,TRUE,FALSE,TRUE
ZTEK,Zentek Ltd. Common Stock,NASDAQ,TRUE,FALSE,TRUE
ZSPC,zSpace, Inc. Common stock,NASDAQ,TRUE,FALSE,TRUE
WCT,Wellchange Holdings Company Limited Ordinary shares,NASDAQ,TRUE,FALSE,TRUE
VRAX,Virax Biolabs Group Limited Ordinary Shares,NASDAQ,TRUE,FALSE,TRUE
VRAR,The Glimpse Group, Inc. Common Stock,NASDAQ,TRUE,FALSE,TRUE
VIVK,Vivakor, Inc. Common Stock,NASDAQ,TRUE,FALSE,TRUE
TXMD,TherapeuticsMD, Inc. Common Stock,NASDAQ,TRUE,FALSE,TRUE
EVAX,Evaxion A/S American Depositary Share,NASDAQ,TRUE,FALSE,TRUE
UHGWW,United Homes Group, Inc. Warrant,NASDAQ,TRUE,FALSE,TRUE
ZYXI,Zynex, Inc. Common Stock,NASDAQ,TRUE,FALSE,TRUE
ZYBT,Zhengye Biotechnology Holding Limited Ordinary Shares,NASDAQ,TRUE,FALSE,TRUE
BWIN,The Baldwin Insurance Group, Inc. Class A Common Stock,NASDAQ,TRUE,TRUE,TRUE
ZVSA,ZyVersa Therapeutics, Inc. Common Stock,NASDAQ,TRUE,FALSE,TRUE
ZURA,Zura Bio Limited Class A Ordinary Shares,NASDAQ,TRUE,FALSE,TRUE
ZTWO,The RBB Fund, Inc. F/m 2-Year Investment Grade Corporate Bond ETF,NASDAQ,TRUE,FALSE,TRUE
ZTOP,The RBB Fund, Inc. F/m High Yield 100 ETF,NASDAQ,TRUE,FALSE,TRUE
ZTEN,The RBB Fund, Inc. F/m 10-Year Investment Grade Corporate Bond ETF,NASDAQ,TRUE,FALSE,TRUE
ZOOZW,ZOOZ Power Ltd. Warrant,NASDAQ,TRUE,FALSE,TRUE
ZOOZ,ZOOZ Power Ltd. Ordinary Shares,NASDAQ,TRUE,FALSE,TRUE
AIFER,Aifeex Nexus Acquisition Corporation Right,NASDAQ,TRUE,FALSE,TRUE
ZKIN,ZK International Group Co., Ltd Ordinary Share,NASDAQ,TRUE,FALSE,TRUE
ZKH,ZKH Group Limited American Depositary Shares, each representing thirty-five (35) Class A Ordinary Shares,NYSE,TRUE,FALSE,TRUE
ZK,ZEEKR Intelligent Technology Holding Limited American Depositary Shares (each representing ten (10) Ordinary Shares),NYSE,TRUE,FALSE,TRUE
ZJK,ZJK Industrial Co., Ltd. Ordinary Shares,NASDAQ,TRUE,FALSE,TRUE
ZIPP,Tidal Trust II STKd 100% UBER & 100% TSLA ETF,NASDAQ,TRUE,FALSE,TRUE
ZEPP,Zepp Health Corporation American depositary shares, each representing sixteen Class A ordinary shares,NYSE,TRUE,FALSE,TRUE
ZEO,Zeo Energy Corporation Class A Common Stock,NASDAQ,TRUE,FALSE,TRUE
ZENV,Zenvia Inc. Class A Common Stock,NASDAQ,TRUE,FALSE,TRUE
ZENA,ZenaTech, Inc. Common Stock,NASDAQ,TRUE,FALSE,TRUE
BWB,Bridgewater Bancshares, Inc. Common Stock,NASDAQ,TRUE,TRUE,TRUE
ZCMD,Zhongchao Inc. Class A Ordinary Shares,NASDAQ,TRUE,FALSE,TRUE
ZBIO,Zenas BioPharma, Inc. Common Stock,NASDAQ,TRUE,FALSE,TRUE
ZBAO,Zhibao Technology Inc. Class A Ordinary Shares,NASDAQ,TRUE,FALSE,TRUE
ZBAI,ATIF Holdings Limited Ordinary Shares,NASDAQ,TRUE,FALSE,TRUE
ADTX,Aditxt, Inc. Common Stock,NASDAQ,TRUE,FALSE,TRUE
ZAP,Global X Funds Global X U.S. Electrification ETF,NASDAQ,TRUE,FALSE,TRUE
YYGH,YY Group Holding Limited Class A Ordinary Shares,NASDAQ,TRUE,FALSE,TRUE
YYAI,Connexa Sports Technologies Inc. Common Stock,NASDAQ,TRUE,FALSE,TRUE
YXT,YXT.COM GROUP HOLDING LIMITED American Depository Shares,NASDAQ,TRUE,FALSE,TRUE
YTRA,Yatra Online, Inc. Ordinary Shares,NASDAQ,TRUE,FALSE,TRUE
YSPY,GraniteShares ETF Trust GraniteShares YieldBOOST SPY ETF,NASDAQ,TRUE,FALSE,TRUE
YQQQ,Tidal Trust II YieldMax Short N100 Option Income Strategy ETF,NASDAQ,TRUE,FALSE,TRUE
YQ,17 Education & Technology Group Inc. American Depositary Shares,NASDAQ,TRUE,FALSE,TRUE
YOSH,Yoshiharu Global Co. Class A Common Stock,NASDAQ,TRUE,FALSE,TRUE
YOKE,EA Series Trust YOKE Core ETF,NASDAQ,TRUE,FALSE,TRUE
YLDE,Legg Mason ETF Investment Trust Franklin ClearBridge Enhanced Income ETF,NASDAQ,TRUE,FALSE,TRUE
BWAY,Brainsway Ltd. American Depositary Shares,NASDAQ,TRUE,TRUE,TRUE
JUNS,Jupiter Neurosciences, Inc. Common Stock,NASDAQ,TRUE,FALSE,TRUE
YIBO,Planet Image International Limited Class A Ordinary Shares,NASDAQ,TRUE,FALSE,TRUE
YI,111, Inc. American Depositary Shares,NASDAQ,TRUE,FALSE,TRUE
YHNAU,YHN Acquisition I Limited Unit,NASDAQ,TRUE,FALSE,TRUE
YHNAR,YHN Acquisition I Limited Right,NASDAQ,TRUE,FALSE,TRUE
YHNA,YHN Acquisition I Limited Ordinary Shares,NASDAQ,TRUE,FALSE,TRUE
YHGJ,Yunhong Green CTI Ltd. Common Stock,NASDAQ,TRUE,FALSE,TRUE
YHC,LQR House Inc. Common Stock,NASDAQ,TRUE,FALSE,TRUE
CICB,CION Investment Corporation 7.50% Notes due 2029,NYSE,TRUE,FALSE,TRUE
YGMZ,MingZhu Logistics Holdings Limited Ordinary Shares,NASDAQ,TRUE,FALSE,TRUE
ADSEW,ADS-TEC ENERGY PLC Warrant,NASDAQ,TRUE,FALSE,TRUE
YAAS,Youxin Technology Ltd Class A Ordinary shares,NASDAQ,TRUE,FALSE,TRUE
XYZG,Themes ETF Trust Leverage Shares 2X Long XYZ Daily ETF,NASDAQ,TRUE,FALSE,TRUE
XYLO,Xylo Technologies Ltd. American Depositary Shares,NASDAQ,TRUE,FALSE,TRUE
XYF,X Financial American Depositary Shares, each representing six Class A Ordinary Shares,NYSE,TRUE,FALSE,TRUE
XXII,22nd Century Group, Inc. Common Stock,NASDAQ,TRUE,FALSE,TRUE
AACG,ATA Creativity Global American Depositary Shares,NASDAQ,TRUE,FALSE,TRUE
XTLB,XTL Biopharmaceuticals Ltd. American Depositary Shares,NASDAQ,TRUE,FALSE,TRUE
XTIA,XTI Aerospace, Inc. Common Stock,NASDAQ,TRUE,FALSE,TRUE
XPON,Expion360 Inc. Common Stock,NASDAQ,TRUE,FALSE,TRUE
XOSWW,Xos, Inc. Warrants,NASDAQ,TRUE,FALSE,TRUE
JUNE,Junee Limited Ordinary Shares,NASDAQ,TRUE,FALSE,TRUE
XOS,Xos, Inc. Common Stock,NASDAQ,TRUE,FALSE,TRUE
XOMZ,Direxion Shares ETF Trust Direxion Daily XOM Bear 1X Shares,NASDAQ,TRUE,FALSE,TRUE
XOMAP,XOMA Royalty Corporation 8.625% Series A Cumulative Perpetual Preferred Stock,NASDAQ,TRUE,FALSE,TRUE
XOMAO,XOMA Royalty Corporation Depositary Shares Rep Series B 8.375% Cumulative Preferred Stock,NASDAQ,TRUE,FALSE,TRUE
CGTL,Creative Global Technology Holdings Limited Class A Ordinary Shares,NASDAQ,TRUE,FALSE,TRUE
BWA,BorgWarner Inc.,NYSE,TRUE,TRUE,TRUE
BVN,Compania de Minas Buenaventura S.A.,NYSE,TRUE,TRUE,TRUE
XMAG,Tidal Trust II Defiance Large Cap ex-Mag 7 ETF,NASDAQ,TRUE,FALSE,TRUE
XLO,Xilio Therapeutics, Inc. Common Stock,NASDAQ,TRUE,FALSE,TRUE
XIN,Xinyuan Real Estate Co. LTD. American Depositary Shares (each Representing twenty Common Shares),NYSE,TRUE,FALSE,TRUE
XHLD,TEN Holdings, Inc. Common Stock,NASDAQ,TRUE,FALSE,TRUE
CETY,Clean Energy Technologies, Inc. Common Stock,NASDAQ,TRUE,FALSE,TRUE
BUSE,First Busey Corporation Class A Common Stock,NASDAQ,TRUE,TRUE,TRUE
XHG,XChange TEC.INC American Depositary Shares,NASDAQ,TRUE,FALSE,TRUE
XFLT.PRA,XAI Octagon Floating Rate & Alternative Income Trust 6.50% Series 2026 Term Preferred Shares, (Liquidation Preference $25.00),NYSE,TRUE,FALSE,TRUE
BURL,BURLINGTON STORES, INC.,NYSE,TRUE,TRUE,TRUE
XELB,Xcel Brands, Inc. Common Stock,NASDAQ,TRUE,FALSE,TRUE
BUXX,Strive Enhanced Income Short Maturity ETF,NYSE,TRUE,FALSE,TRUE
XCUR,Exicure, Inc. Common Stock,NASDAQ,TRUE,FALSE,TRUE
XCNY,SPDR Index Shares Fund SPDR S&P Emerging Markets ex-China ETF,NASDAQ,TRUE,FALSE,TRUE
XCH,XCHG Limited American Depositary Share,NASDAQ,TRUE,FALSE,TRUE
XBPEW,XBP Europe Holdings, Inc. Warrant,NASDAQ,TRUE,FALSE,TRUE
XBP,XBP Europe Holdings, Inc. Common Stock,NASDAQ,TRUE,FALSE,TRUE
XBIO,Xenetic Biosciences, Inc. Common Stock,NASDAQ,TRUE,FALSE,TRUE
XAIX,DBX ETF Trust Xtrackers Artificial Intelligence and Big Data ETF,NASDAQ,TRUE,FALSE,TRUE
XAIR,Beyond Air, Inc. Common Stock,NASDAQ,TRUE,FALSE,TRUE
XAGEW,Longevity Health Holdings, Inc. Warrant,NASDAQ,TRUE,FALSE,TRUE
XAGE,Longevity Health Holdings, Inc. Common Stock,NASDAQ,TRUE,FALSE,TRUE
WYHG,Wing Yip Food Holdings Group Limited American Depositary Shares,NASDAQ,TRUE,FALSE,TRUE
WXM,WF International Limited Ordinary Shares,NASDAQ,TRUE,FALSE,TRUE
WVVIP,Willamette Valley Vineyards, Inc. Series A Redeemable Preferred Stock,NASDAQ,TRUE,FALSE,TRUE
WVVI,Willamette Valley Vineyards, Inc. Common Stock,NASDAQ,TRUE,FALSE,TRUE
EURKU,Eureka Acquisition Corp Unit,NASDAQ,TRUE,FALSE,TRUE
WTO,UTime Limited Ordinary Shares,NASDAQ,TRUE,FALSE,TRUE
WTMY,WisdomTree Trust WisdomTree High Income Laddered Municipal Fund,NASDAQ,TRUE,FALSE,TRUE
WTMU,WisdomTree Trust WisdomTree Core Laddered Municipal Fund,NASDAQ,TRUE,FALSE,TRUE
EURKR,Eureka Acquisition Corp Right,NASDAQ,TRUE,FALSE,TRUE
COLAR,Columbus Acquisition Corp Rights,NASDAQ,TRUE,FALSE,TRUE
WTI,W&T Offshore, Inc.,NYSE,TRUE,FALSE,TRUE
APPX,Investment Managers Series Trust II Tradr 2X Long APP Daily ETF,NASDAQ,TRUE,FALSE,TRUE
WTFCP,Wintrust Financial Corporation Depositary Shares, Each Representing a 1/1,000th Interest in a Share of 6.875% Fixed-Rate Reset Non-Cumulative Perpetual Preferred Stock, Series E,NASDAQ,TRUE,FALSE,TRUE
WTFCM,Wintrust Financial Corporation Fixed-to-Floating Rate Non-Cumulative Perpetual Preferred Stock, Series D,NASDAQ,TRUE,FALSE,TRUE
WTF,Waton Financial Limited Ordinary Shares,NASDAQ,TRUE,FALSE,TRUE
WTBN,WisdomTree Trust WisdomTree Bianco Total Return Fund,NASDAQ,TRUE,FALSE,TRUE
AIFE,Aifeex Nexus Acquisition Corporation Class A Ordinary Shares,NASDAQ,TRUE,FALSE,TRUE
WSML,iShares Trust iShares MSCI World Small-Cap ETF,NASDAQ,TRUE,FALSE,TRUE
WSBF,Waterstone Financial, Inc. Common Stock (MD),NASDAQ,TRUE,FALSE,TRUE
WSBCP,WesBanco, Inc. Depositary Shares, Each Representing a 1/40th Interest in a Share of 6.75% Fixed-Rate Reset Non-Cumulative Perpetual Preferred Stock, Series A,NASDAQ,TRUE,FALSE,TRUE
WRND,New York Life Investments ETF Trust NYLI Global Equity R&D Leaders ETF,NASDAQ,TRUE,FALSE,TRUE
WRB.PRH,W.R. Berkley Corporation 4.125% Subordinated Debentures due 2061,NYSE,TRUE,FALSE,TRUE
WRB.PRG,W.R. Berkley Corporation 4.25% Subordinated Debentures due 2060,NYSE,TRUE,FALSE,TRUE
WRB.PRF,W.R. Berkley Corporation 5.10% Subordinated Debentures due 2059,NYSE,TRUE,FALSE,TRUE
GECCI,Great Elm Capital Corp. 8.50% NOTES DUE 2029,NASDAQ,TRUE,FALSE,TRUE
WRB.PRE,W.R. Berkley Corporation 5.70% Subordinated Debentures due 2058,NYSE,TRUE,FALSE,TRUE
WRAP,Wrap Technologies, Inc. Common Stock,NASDAQ,TRUE,FALSE,TRUE
WOOD,iShares Global Timber & Forestry ETF,NASDAQ,TRUE,FALSE,TRUE
WOLF,Wolfspeed, Inc.,NYSE,TRUE,FALSE,TRUE
WOK,WORK Medical Technology Group LTD Class A Ordinary Shares,NASDAQ,TRUE,FALSE,TRUE
WNW,Meiwu Technology Company Limited Ordinary Shares,NASDAQ,TRUE,FALSE,TRUE
BUR,Burford Capital Limited,NYSE,TRUE,TRUE,TRUE
BUG,Global X Funds Global X Cybersecurity ETF,NASDAQ,TRUE,TRUE,TRUE
WNDY,Global X Funds Global X Wind Energy ETF,NASDAQ,TRUE,FALSE,TRUE
ACXP,Acurx Pharmaceuticals, Inc. Common Stock,NASDAQ,TRUE,FALSE,TRUE
WLYB,John Wiley & Sons, Inc. Class B,NYSE,TRUE,FALSE,TRUE
WLTG,WealthTrust DBS Long Term Growth ETF,NYSE,TRUE,FALSE,TRUE
WLGS,Wang & Lee Group, Inc. Ordinary Shares,NASDAQ,TRUE,FALSE,TRUE
WLDS,Wearable Devices Ltd. Ordinary Share,NASDAQ,TRUE,FALSE,TRUE
WLACW,Willow Lane Acquisition Corp. Warrants,NASDAQ,TRUE,FALSE,TRUE
WKSP,Worksport, Ltd. Common Stock,NASDAQ,TRUE,FALSE,TRUE
WKHS,Workhorse Group, Inc. Common Stock,NASDAQ,TRUE,FALSE,TRUE
WKEY,WISeKey International Holding Ltd American Depositary Shares,NASDAQ,TRUE,FALSE,TRUE
WIW,Western Asset Inflation-Linked Opportunities & Income Fund,NYSE,TRUE,FALSE,TRUE
WISE,Themes ETF Trust Themes Generative Artificial Intelligence ETF,NASDAQ,TRUE,FALSE,TRUE
WINT,Windtree Therapeutics, Inc. Common Stock,NASDAQ,TRUE,FALSE,TRUE
COLA,Columbus Acquisition Corp Ordinary Shares,NASDAQ,TRUE,FALSE,TRUE
WINN,Harbor Long-Term Growers ETF,NYSE,TRUE,FALSE,TRUE
WINC,Legg Mason ETF Investment Trust Western Asset Short Duration Income ETF,NASDAQ,TRUE,FALSE,TRUE
TYGO,Tigo Energy, Inc. Common Stock,NASDAQ,TRUE,FALSE,TRUE
WILC,G. Willi-Food International,  Ltd. Ordinary Shares,NASDAQ,TRUE,FALSE,TRUE
WIA,Western Asset Inflation-Linked Income Fund,NYSE,TRUE,FALSE,TRUE
WHLRL,Wheeler Real Estate Investment Trust, Inc. 7.00% Senior Subordinated Convertible Notes Due 2031,NASDAQ,TRUE,FALSE,TRUE
BUD,Anheuser-Busch INBEV SA/NV,NYSE,TRUE,TRUE,TRUE
WHLR,Wheeler Real Estate Investment Trust, Inc. Common Stock,NASDAQ,TRUE,FALSE,TRUE
WHG,WESTWOOD HOLDINGS GROUP, INC.,NYSE,TRUE,FALSE,TRUE
WHFCL,WhiteHorse Finance, Inc. 7.875% Notes due 2028,NASDAQ,TRUE,FALSE,TRUE
WGSWW,GeneDx Holdings Corp. Warrant,NASDAQ,TRUE,FALSE,TRUE
WGRX,Wellgistics Health, Inc. Common Stock,NASDAQ,TRUE,FALSE,TRUE
WFF,WF Holding Limited Ordinary Shares,NASDAQ,TRUE,FALSE,TRUE
WFCF,Where Food Comes From, Inc. Common Stock,NASDAQ,TRUE,FALSE,TRUE
WFC.PRY,Wells Fargo & Company,NYSE,TRUE,FALSE,TRUE
WFC.PRL,WELLS FARGO 7.5% NON CUMV PERP CONV,NYSE,TRUE,FALSE,TRUE
WFC.PRD,Wells Fargo & Company Depositary Shares, each representing a 1/1, 000th interest in a share of Non-Cumulative Perpetual Class A Preferred Stock, Series DD,NYSE,TRUE,FALSE,TRUE
WFC.PRC,Wells Fargo & Company Depositary Shares, each representing a 1/1, 000th interest in a share of Non-Cumulative Perpetual Class A Preferred Stock, Series CC,NYSE,TRUE,FALSE,TRUE
WFC.PRA,Wells Fargo & Company Depositary Shares, each representing a 1/1, 000th interest in a share of Non-Cumulative Perpetual Class A Preferred Stock, Series AA,NYSE,TRUE,FALSE,TRUE
WF,Woori Financial Group Inc. American Depositary Shares (each representing three (3) shares of Common Stock),NYSE,TRUE,FALSE,TRUE
WETO,Webus International Limited Ordinary Shares,NASDAQ,TRUE,FALSE,TRUE
WETH,Wetouch Technology Inc. Common Stock,NASDAQ,TRUE,FALSE,TRUE
WENNU,Wen Acquisition Corp Unit,NASDAQ,TRUE,FALSE,TRUE
WEEI,Ultimus Managers Trust Westwood Salient Enhanced Energy Income ETF,NASDAQ,TRUE,FALSE,TRUE
WEA,Western Asset Premier Bond Fund,NYSE,TRUE,FALSE,TRUE
WDI,Western Asset Diversified Income Fund,NYSE,TRUE,FALSE,TRUE
WDH,Waterdrop Inc. American Depositary Shares (each representing the right to receive 10 Class A Ordinary Shares),NYSE,TRUE,FALSE,TRUE
WCBR,WisdomTree Trust WisdomTree Cybersecurity Fund,NASDAQ,TRUE,FALSE,TRUE
WBUY,WEBUY GLOBAL LTD. Class A Ordinary Shares,NASDAQ,TRUE,FALSE,TRUE
WBTN,WEBTOON Entertainment Inc. Common stock,NASDAQ,TRUE,FALSE,TRUE
WBS.PRG,Webster Financial Corporation Depositary Shares, each representing a 1/40th interest in a share of 6.50% Series G noncumulative perpetual preferred stock,NYSE,TRUE,FALSE,TRUE
WBS.PRF,Webster Financial Corporation Depositary Shares, Each Representing 1/1,000th Interest in a Share of 5.25% Series F Non-Cumulative Perpetual Preferred Stock,NYSE,TRUE,FALSE,TRUE
WBND,Legg Mason ETF Investment Trust Western Asset Total Return ETF,NASDAQ,TRUE,FALSE,TRUE
WAVE,Eco Wave Power Global AB (publ) American Depositary Shares,NASDAQ,TRUE,FALSE,TRUE
WATT,Energous Corporation Common Stock,NASDAQ,TRUE,FALSE,TRUE
WALDW,Waldencast plc Warrant,NASDAQ,TRUE,FALSE,TRUE
WALD,Waldencast plc Class A Ordinary Share,NASDAQ,TRUE,FALSE,TRUE
WAL.PRA,Western Alliance Bancorporation Depositary Shares, Each Representing a 1/ 400th Interest in a Share of 4.250% Fixed-Rate Non-Cumulative Perpetual Preferred Stock, Series A,NYSE,TRUE,FALSE,TRUE
WAFU,Wah Fu Education Group Limited Ordinary Shares,NASDAQ,TRUE,FALSE,TRUE
WABF,Franklin Templeton ETF Trust Western Asset Bond ETF,NASDAQ,TRUE,FALSE,TRUE
VXRT,Vaxart, Inc Common Stock,NASDAQ,TRUE,FALSE,TRUE
VVPR,VivoPower International PLC Ordinary Shares,NASDAQ,TRUE,FALSE,TRUE
VVOS,Vivos Therapeutics, Inc. Common Stock,NASDAQ,TRUE,FALSE,TRUE
VUZI,Vuzix Corporation Common Stock,NASDAQ,TRUE,FALSE,TRUE
VTVT,vTv Therapeutics Inc. Class A Common Stock,NASDAQ,TRUE,FALSE,TRUE
VTN,Invesco  Trust for Investment Grade New York Municipals,NYSE,TRUE,FALSE,TRUE
VSTEW,Vast Renewables Limited Warrants,NASDAQ,TRUE,FALSE,TRUE
VSTE,Vast Renewables Limited Ordinary Shares,NASDAQ,TRUE,FALSE,TRUE
VSTA,Vasta Platform Limited Class A Ordinary Shares,NASDAQ,TRUE,FALSE,TRUE
VSSYW,Versus Systems Inc. Class A Warrants,NASDAQ,TRUE,FALSE,TRUE
VSMV,Victory Portfolios II VictoryShares US Multi-Factor Minimum Volatility ETF,NASDAQ,TRUE,FALSE,TRUE
VSME,VS Media Holdings Limited Class A Ordinary Shares,NASDAQ,TRUE,FALSE,TRUE
VSEEW,VSee Health, Inc. Warrant,NASDAQ,TRUE,FALSE,TRUE
VSEE,VSee Health, Inc. Common Stock,NASDAQ,TRUE,FALSE,TRUE
VSA,TCTM Kids IT Education Inc. American Depositary Shares,NASDAQ,TRUE,FALSE,TRUE
VS,Versus Systems Inc. Common Stock,NASDAQ,TRUE,FALSE,TRUE
JTEK,J.P. Morgan Exchange-Traded Fund Trust JPMorgan U.S. Tech Leaders ETF,NASDAQ,TRUE,FALSE,TRUE
VRTL,GraniteShares ETF Trust GraniteShares 2x Long VRT Daily ETF,NASDAQ,TRUE,FALSE,TRUE
VRMEW,VerifyMe, Inc. Warrant,NASDAQ,TRUE,FALSE,TRUE
VRME,VerifyMe, Inc. Common Stock,NASDAQ,TRUE,FALSE,TRUE
VRM,Vroom, Inc. Common Stock,NASDAQ,TRUE,FALSE,TRUE
VRCA,Verrica Pharmaceuticals Inc. Common Stock,NASDAQ,TRUE,FALSE,TRUE
VPV,Invesco  Pennsylvania Value Municipal Income Trust,NYSE,TRUE,FALSE,TRUE
VPLS,Vanguard Malvern Funds Vanguard Core Plus Bond ETF,NASDAQ,TRUE,FALSE,TRUE
VOYA.PRB,Voya Financial, Inc. Depositary Shares, each representing a 1/40th interest in a share of 5.35% Fixed-Rate Reset Non-Cumulative Preferred Stock, Series B,NYSE,TRUE,FALSE,TRUE
JTAI,Jet.AI Inc. Common Stock,NASDAQ,TRUE,FALSE,TRUE
VOTE,TCW Transform 500 ETF,NYSE,TRUE,FALSE,TRUE
VOR,Vor Biopharma Inc. Common Stock,NASDAQ,TRUE,FALSE,TRUE
VOLT,Tema ETF Trust Tema Electrification ETF,NASDAQ,TRUE,FALSE,TRUE
VOC,VOC ENERGY TRUST,NYSE,TRUE,FALSE,TRUE
EURK,Eureka Acquisition Corp Class A Ordinary Share,NASDAQ,TRUE,FALSE,TRUE
AACBU,Artius II Acquisition Inc. Units,NASDAQ,TRUE,FALSE,TRUE
VNO.PRO,Vornado Realty Trust 4.45% Series O Cumulative Redeemable Preferred Shares, Liquidation Preference $25.00 Per Share,NYSE,TRUE,FALSE,TRUE
VNO.PRN,Vornado Realty Trust 5.25% Series N Cumulative Redeemable Preferred Shares of Beneficial Interest, liquidation preference $25.00 per share,NYSE,TRUE,FALSE,TRUE
VNO.PRM,Vornado Realty Trust 5.25% Series M Cumulative Redeemable Preferred Shares of Beneficial Interest, liquidation preference $25.00 per share, no par value per share,NYSE,TRUE,FALSE,TRUE
BTX,BlackRock Technology and Private Equity Term Trust,NYSE,TRUE,TRUE,TRUE
VNCE,VINCE HOLDING CORP.,NYSE,TRUE,FALSE,TRUE
JSML,Janus Detroit Street Trust Janus Henderson Small Cap Growth Alpha ETF,NASDAQ,TRUE,FALSE,TRUE
BTSG,BrightSpring Health Services, Inc. Common Stock,NASDAQ,TRUE,TRUE,TRUE
VMO,Invesco Municipal Opportunity Trust,NYSE,TRUE,FALSE,TRUE
