Symbol,Name,Exchange,Tradable,Shortable,Marginable
LNSR,LENSAR, Inc. Common Stock,NASDAQ,TRUE,TRUE,TRUE
LNG,Cheniere Energy Inc,NYSE,TRUE,TRUE,TRUE
IRS,IRSA Inversiones y Representaciones S.A. Global Depositary Shares,NYSE,TRUE,FALSE,TRUE
LNC.PRD,Lincoln National Corporation Depositary Shares Each Representing a 1/1,000th Interest in a Share of 9.000% Non-Cumulative Preferred Stock, Series D,NYSE,TRUE,TRUE,TRUE
LNC,Lincoln National Corp.,NYSE,TRUE,TRUE,TRUE
IROHW,Iron Horse Acquisitions Corp. Warrant,NASDAQ,TRUE,FALSE,TRUE
LMT,Lockheed Martin Corp.,NYSE,TRUE,TRUE,TRUE
BDGS,EA Series Trust Bridges Capital Tactical ETF,NASDAQ,TRUE,FALSE,TRUE
EQV.WS,EQV Ventures Acquisition Redeemable warrants, each whole warrant exercisable for one Class A ordinary share at an exercise price of $11.50 per share,NYSE,TRUE,FALSE,TRUE
LMB,Limbach Holdings, Inc. Common Stock,NASDAQ,TRUE,TRUE,TRUE
IROHU,Iron Horse Acquisitions Corp. Unit,NASDAQ,TRUE,FALSE,TRUE
IROHR,Iron Horse Acquisitions Corp. Right,NASDAQ,TRUE,FALSE,TRUE
LLYVK,Liberty Media Corporation Series C Liberty Live Common Stock,NASDAQ,TRUE,TRUE,TRUE
LLYVA,Liberty Media Corporation Series A Liberty Live Common Stock,NASDAQ,TRUE,TRUE,TRUE
LLY,Eli Lilly & Co.,NYSE,TRUE,TRUE,TRUE
LKQ,LKQ Corporation Common Stock,NASDAQ,TRUE,TRUE,TRUE
LIVN,LivaNova PLC Ordinary Shares,NASDAQ,TRUE,TRUE,TRUE
LITE,Lumentum Holdings Inc. Common Stock,NASDAQ,TRUE,TRUE,TRUE
LIND,Lindblad Expeditions Holdings Inc. Common Stock,NASDAQ,TRUE,TRUE,TRUE
BIT,BLACKROCK MULTI-SECTOR INCOME TRUST,NYSE,TRUE,TRUE,TRUE
LINC,Lincoln Educational Services Corporation Common Stock,NASDAQ,TRUE,TRUE,TRUE
LIN,Linde plc Ordinary Shares,NASDAQ,TRUE,TRUE,TRUE
LILAK,Liberty Latin America Ltd. Class C Common Stock,NASDAQ,TRUE,TRUE,TRUE
BIRK,Birkenstock Holding plc,NYSE,TRUE,TRUE,TRUE
LILA,Liberty Latin America Ltd. Class A Common Stock,NASDAQ,TRUE,TRUE,TRUE
LII,Lennox International Inc.,NYSE,TRUE,TRUE,TRUE
LI,Li Auto Inc. American Depositary Shares,NASDAQ,TRUE,TRUE,TRUE
LHX,L3Harris Technologies, Inc.,NYSE,TRUE,TRUE,TRUE
LH,Labcorp Holdings Inc.,NYSE,TRUE,TRUE,TRUE
LGND,Ligand Pharmaceuticals Incorporated Common Stock,NASDAQ,TRUE,TRUE,TRUE
LFST,LifeStance Health Group, Inc. Common Stock,NASDAQ,TRUE,TRUE,TRUE
LFMD,LifeMD, Inc. Common Stock,NASDAQ,TRUE,TRUE,TRUE
LFCR,Lifecore Biomedical, Inc. Common Stock,NASDAQ,TRUE,TRUE,TRUE
LEVI,Levi Strauss & Co. Class A Common Stock,NYSE,TRUE,TRUE,TRUE
IROH,Iron Horse Acquisitions Corp. Common Stock,NASDAQ,TRUE,FALSE,TRUE
LEN,Lennar Corporation Class A,NYSE,TRUE,TRUE,TRUE
LEGN,Legend Biotech Corporation American Depositary Shares,NASDAQ,TRUE,TRUE,TRUE
LEG,Leggett & Platt, Inc.,NYSE,TRUE,TRUE,TRUE
LEE,Lee Enterprises, Incorporated Common Stock,NASDAQ,TRUE,TRUE,TRUE
BIRD,Allbirds, Inc. Class A Common Stock,NASDAQ,TRUE,TRUE,TRUE
LECO,Lincoln Electric Holdings, Inc. Common Shares,NASDAQ,TRUE,TRUE,TRUE
LE,Lands' End, Inc. Common Stock,NASDAQ,TRUE,TRUE,TRUE
LDOS,Leidos Holdings, Inc.,NYSE,TRUE,TRUE,TRUE
LCUT,Lifetime Brands, Inc. Common Stock,NASDAQ,TRUE,TRUE,TRUE
LCID,Lucid Group, Inc. Common Stock,NASDAQ,TRUE,TRUE,TRUE
LC,LendingClub Corporation,NYSE,TRUE,TRUE,TRUE
BIPC,Brookfield Infrastructure Corporation Class A Exchangeable Subordinate Voting Shares,NYSE,TRUE,TRUE,TRUE
LBTYK,Liberty Global Ltd. Class C Common Shares,NASDAQ,TRUE,TRUE,TRUE
LBTYA,Liberty Global Ltd. Class A Common Shares,NASDAQ,TRUE,TRUE,TRUE
BIP,Brookfield Infrastructure Partners L.P. Limited Partnership Units,NYSE,TRUE,TRUE,TRUE
HYDR,Global X Funds Global X Hydrogen ETF,NASDAQ,TRUE,FALSE,TRUE
EQV.U,EQV Ventures Acquisition Corp. Units, each consisting of one Class A ordinary share and one-third of one redeemable warrant,NYSE,TRUE,FALSE,TRUE
HYBX,TCW High Yield Bond ETF,NYSE,TRUE,FALSE,TRUE
LBRT,Liberty Energy Inc.,NYSE,TRUE,TRUE,TRUE
LBRDK,Liberty Broadband Corporation Class C Common Stock,NASDAQ,TRUE,TRUE,TRUE
EQRR,ProShares Trust ProShares Equities for Rising Rates ETF,NASDAQ,TRUE,FALSE,TRUE
CNFRZ,Conifer Holdings, Inc. 9.75% Senior Unsecured Notes due 2028,NASDAQ,TRUE,FALSE,TRUE
LBRDA,Liberty Broadband Corporation Class A Common Stock,NASDAQ,TRUE,TRUE,TRUE
LB,LandBridge Company LLC,NYSE,TRUE,TRUE,TRUE
LAZ,Lazard, Inc.,NYSE,TRUE,TRUE,TRUE
LAUR,Laureate Education, Inc. Common Stock,NASDAQ,TRUE,TRUE,TRUE
LAND,Gladstone Land Corporation Common Stock,NASDAQ,TRUE,TRUE,TRUE
LAMR,Lamar Advertising Company Class A Common Stock,NASDAQ,TRUE,TRUE,TRUE
LAKE,Lakeland Industries, Inc. Common Stock,NASDAQ,TRUE,TRUE,TRUE
LADR,LADDER CAPITAL CORP,NYSE,TRUE,TRUE,TRUE
LAD,Lithia Motors, Inc.,NYSE,TRUE,TRUE,TRUE
LAB,Standard BioTools Inc. Common Stock,NASDAQ,TRUE,TRUE,TRUE
BIOX,Bioceres Crop Solutions Corp. Ordinary Shares,NASDAQ,TRUE,TRUE,TRUE
L,Loews Corporation,NYSE,TRUE,TRUE,TRUE
IQST,IQSTEL INC. Common Stock,NASDAQ,TRUE,FALSE,TRUE
HYBI,NEOS ETF Trust NEOS Enhanced Income Credit Select ETF,NASDAQ,TRUE,FALSE,TRUE
KYTX,Kyverna Therapeutics, Inc. Common Stock,NASDAQ,TRUE,TRUE,TRUE
KYN,Kayne Anderson Energy Infrastructure Fund, Inc.,NYSE,TRUE,TRUE,TRUE
KW,KENNEDY-WILSON HOLDINGS, INC.,NYSE,TRUE,TRUE,TRUE
HYAC.WS,Haymaker Acquisition Corp. 4 Warrants, each whole warrant exercisable for one Class A ordinary share at an exercise price of $11.50 per share,NYSE,TRUE,FALSE,TRUE
KVYO,Klaviyo, Inc.,NYSE,TRUE,TRUE,TRUE
KURA,Kura Oncology, Inc. Common Stock,NASDAQ,TRUE,TRUE,TRUE
KTOS,Kratos Defense & Security Solutions, Inc. Common Stock,NASDAQ,TRUE,TRUE,TRUE
KTCC,Key Tronic Corporation Common Stock,NASDAQ,TRUE,TRUE,TRUE
KTB,Kontoor Brands, Inc. Common Stock,NYSE,TRUE,TRUE,TRUE
KSPI,Joint Stock Company Kaspi.kz American Depository Shares,NASDAQ,TRUE,TRUE,TRUE
KRYS,Krystal Biotech, Inc. Common Stock,NASDAQ,TRUE,TRUE,TRUE
KRUS,Kura Sushi USA, Inc. Class A Common Stock,NASDAQ,TRUE,TRUE,TRUE
KRRO,Korro Bio, Inc. Common Stock,NASDAQ,TRUE,TRUE,TRUE
KRP,Kimbell Royalty Partners, LP Common Units representing Limited Partner Interests,NYSE,TRUE,TRUE,TRUE
KROS,Keros Therapeutics, Inc. Common Stock,NASDAQ,TRUE,TRUE,TRUE
KRNY,Kearny Financial Corp Common Stock,NASDAQ,TRUE,TRUE,TRUE
KRNT,Kornit Digital Ltd. Ordinary Shares,NASDAQ,TRUE,TRUE,TRUE
KRG,Kite Realty Group Trust,NYSE,TRUE,TRUE,TRUE
BILI,Bilibili Inc. American Depositary Shares,NASDAQ,TRUE,TRUE,TRUE
KREF,KKR Real Estate Finance Trust Inc.,NYSE,TRUE,TRUE,TRUE
KRC,Kilroy Realty Corp.,NYSE,TRUE,TRUE,TRUE
KR,The Kroger Co.,NYSE,TRUE,TRUE,TRUE
HYAC.U,Haymaker Acquisition Corp. 4 Units, each consisting one Class A Ordinary Share and one-half of one redeemable Warrant,NYSE,TRUE,FALSE,TRUE
KO,Coca-Cola Company,NYSE,TRUE,TRUE,TRUE
KNX,Knight-Swift Transportation Holdings Inc. Class A Common Stock,NYSE,TRUE,TRUE,TRUE
KNTK,Kinetik Holdings Inc.,NYSE,TRUE,TRUE,TRUE
KNSL,Kinsale Capital Group, Inc.,NYSE,TRUE,TRUE,TRUE
KNOP,KNOT OFFSHORE PARTNERS LP,NYSE,TRUE,TRUE,TRUE
KNF,Knife River Corporation,NYSE,TRUE,TRUE,TRUE
KNDI,Kandi Technologies Group, Inc. Ordinary Shares,NASDAQ,TRUE,TRUE,TRUE
BIIB,Biogen Inc. Common Stock,NASDAQ,TRUE,TRUE,TRUE
KN,KNOWLES CORPORATION,NYSE,TRUE,TRUE,TRUE
KMT,Kennametal Inc.,NYSE,TRUE,TRUE,TRUE
BIGC,BigCommerce Holdings, Inc. Series 1 Common Stock,NASDAQ,TRUE,TRUE,TRUE
BIDU,Baidu, Inc. ADS,NASDAQ,TRUE,TRUE,TRUE
KMPR,Kemper Corporation,NYSE,TRUE,TRUE,TRUE
KMI,Kinder Morgan, Inc.,NYSE,TRUE,TRUE,TRUE
KMB,Kimberly-Clark Corp.,NYSE,TRUE,TRUE,TRUE
KLXE,KLX Energy Services Holdings, Inc. Common Stock,NASDAQ,TRUE,TRUE,TRUE
KLTR,Kaltura, Inc. Common Stock,NASDAQ,TRUE,TRUE,TRUE
CNFR,Conifer Holdings, Inc. Common Stock,NASDAQ,TRUE,FALSE,TRUE
KLRS,Kalaris Therapeutics, Inc. Common Stock,NASDAQ,TRUE,TRUE,TRUE
KLIC,Kulicke and Soffa Industries, Inc. Common Stock,NASDAQ,TRUE,TRUE,TRUE
KLG,WK Kellogg Co,NYSE,TRUE,TRUE,TRUE
KLC,KinderCare Learning Companies, Inc.,NYSE,TRUE,TRUE,TRUE
KLAC,KLA Corporation Common Stock,NASDAQ,TRUE,TRUE,TRUE
KKRS,KKR Group Finance Co. IX LLC 4.625% Subordinated Notes due 2061,NYSE,TRUE,TRUE,TRUE
HYAC,Haymaker Acquisition Corp. 4,NYSE,TRUE,FALSE,TRUE
KKR,KKR & Co. Inc.,NYSE,TRUE,TRUE,TRUE
KINS,Kingstone Companies, Inc. Common Stock,NASDAQ,TRUE,TRUE,TRUE
KIND,Nextdoor Holdings, Inc.,NYSE,TRUE,TRUE,TRUE
KIM,Kimco Realty Corp.,NYSE,TRUE,TRUE,TRUE
KIDS,OrthoPediatrics Corp. Common Stock,NASDAQ,TRUE,TRUE,TRUE
KHC,The Kraft Heinz Company Common Stock,NASDAQ,TRUE,TRUE,TRUE
KGS,Kodiak Gas Services, Inc.,NYSE,TRUE,TRUE,TRUE
KGEI,Kolibri Global Energy Inc. Common stock,NASDAQ,TRUE,TRUE,TRUE
KGC,Kinross Gold Corporation,NYSE,TRUE,TRUE,TRUE
KFY,Korn Ferry,NYSE,TRUE,TRUE,TRUE
KFRC,Kforce Inc.,NYSE,TRUE,TRUE,TRUE
KEYS,Keysight Technologies, Inc.,NYSE,TRUE,TRUE,TRUE
IQI,INVESCO QUALITY MUNICIPAL SECURITIES,NYSE,TRUE,FALSE,TRUE
HXHX,Haoxin Holdings Limited Class A Ordinary Shares,NASDAQ,TRUE,FALSE,TRUE
KEX,Kirby Corporation,NYSE,TRUE,TRUE,TRUE
KELYA,Kelly Services, Inc. Class A Common Stock,NASDAQ,TRUE,TRUE,TRUE
KE,Kimball Electronics, Inc. Common Stock,NASDAQ,TRUE,TRUE,TRUE
KDP,Keurig Dr Pepper Inc. Common Stock,NASDAQ,TRUE,TRUE,TRUE
KD,Kyndryl Holdings, Inc.,NYSE,TRUE,TRUE,TRUE
KC,Kingsoft Cloud Holdings Limited American Depositary Shares,NASDAQ,TRUE,TRUE,TRUE
KBWD,Invesco Exchange-Traded Fund Trust II Invesco KBW High Dividend Yield Financial ETF,NASDAQ,TRUE,TRUE,TRUE
KBWB,Invesco Exchange-Traded Fund Trust II Invesco KBW Bank ETF,NASDAQ,TRUE,TRUE,TRUE
KBR,KBR, Inc.,NYSE,TRUE,TRUE,TRUE
BHVN,Biohaven Ltd.,NYSE,TRUE,TRUE,TRUE
BHRB,Burke & Herbert Financial Services Corp. Common Stock,NASDAQ,TRUE,TRUE,TRUE
KB,KB Financial Group Inc,NYSE,TRUE,TRUE,TRUE
KARO,Karooooo Ltd. Ordinary Shares,NASDAQ,TRUE,TRUE,TRUE
KALV,KalVista Pharmaceuticals, Inc. Common Stock,NASDAQ,TRUE,TRUE,TRUE
EQ,Equillium, Inc. Common Stock,NASDAQ,TRUE,FALSE,TRUE
KALU,Kaiser Aluminum Corporation Common Stock,NASDAQ,TRUE,TRUE,TRUE
JYNT,The Joint Corp. Common Stock,NASDAQ,TRUE,TRUE,TRUE
JXN,Jackson Financial Inc.,NYSE,TRUE,TRUE,TRUE
HWSM,Hotchkis & Wiley SMID Cap Diversified Value Fund,NASDAQ,TRUE,FALSE,TRUE
JSPR,Jasper Therapeutics, Inc. Common Stock,NASDAQ,TRUE,TRUE,TRUE
JRVR,James River Group Holdings, Ltd. Common Shares,NASDAQ,TRUE,TRUE,TRUE
JPM.PRL,JPMorgan Chase & Co. Depositary Shares, each representing a 1/400th interest in a share of 4.625% Non-Cumulative Preferred Stock, Series LL,NYSE,TRUE,TRUE,TRUE
JPM.PRK,JPMorgan Chase & Co. Depositary Shares, each representing a 1/400th interest in a share of 4.55% Non-Cumulative Preferred Stock, Series JJ,NYSE,TRUE,TRUE,TRUE
JPM.PRJ,JPMorgan Chase & Co. Depositary Shares, each representing a 1/400th interest in a share of JPMorgan Chase & Co. 4.75% Non-Cumulative Preferred Stock, Series GG,NYSE,TRUE,TRUE,TRUE
JPM.PRD,JPMorgan Chase & Co. Depositary Shares, each representing a 1/400th interest in a share of 5.75% Non-Cumulative Preferred Stock, Series DD,NYSE,TRUE,TRUE,TRUE
JPM.PRC,JPMorgan Chase & Co. Depositary Shares, each representing a 1/400th interest in a share of 6.00% Non-Cumulative Preferred Stock, Series EE,NYSE,TRUE,TRUE,TRUE
BHR,Braemar Hotels & Resorts Inc. Common Stock,NYSE,TRUE,TRUE,TRUE
HWH,HWH International Inc. Common Stock,NASDAQ,TRUE,FALSE,TRUE
JPM,JPMorgan Chase & Co.,NYSE,TRUE,TRUE,TRUE
JPC,Nuveen Preferred & Income Opportunities Fund,NYSE,TRUE,TRUE,TRUE
JOYY,JOYY Inc. American Depositary Shares,NASDAQ,TRUE,TRUE,TRUE
JOE,St. Joe Company,NYSE,TRUE,TRUE,TRUE
JNPR,Juniper Networks Inc,NYSE,TRUE,TRUE,TRUE
JMIA,Jumia Technologies AG,NYSE,TRUE,TRUE,TRUE
IPX,IperionX Limited American Depositary Share,NASDAQ,TRUE,FALSE,TRUE
JKS,JINKOSOLAR HOLDINGS CO,NYSE,TRUE,TRUE,TRUE
JKHY,Jack Henry & Associates, Inc. Common Stock,NASDAQ,TRUE,TRUE,TRUE
JILL,J.Jill, Inc. Common Stock,NYSE,TRUE,TRUE,TRUE
JHX,JAMES HARDIE INDUSTRIES plc.,NYSE,TRUE,TRUE,TRUE
IPW,iPower Inc. Common Stock,NASDAQ,TRUE,FALSE,TRUE
JFIN,Jiayin Group Inc. American Depositary Shares,NASDAQ,TRUE,TRUE,TRUE
IPSC,Century Therapeutics, Inc. Common Stock,NASDAQ,TRUE,FALSE,TRUE
JEPQ,J.P. Morgan Exchange-Traded Fund Trust JPMorgan Nasdaq Equity Premium Income ETF,NASDAQ,TRUE,TRUE,TRUE
JELD,JELD-WEN Holding, Inc.,NYSE,TRUE,TRUE,TRUE
BHP,BHP Group Limited American Depositary Shares (Each representing two Ordinary Shares),NYSE,TRUE,TRUE,TRUE
HWCPZ,Hancock Whitney Corporation 6.25% Subordinated Notes due 2060,NASDAQ,TRUE,FALSE,TRUE
JEF,Jefferies Financial Group Inc.,NYSE,TRUE,TRUE,TRUE
JD,JD.com, Inc. American Depositary Shares,NASDAQ,TRUE,TRUE,TRUE
IPODU,Dune Acquisition Corporation II Units,NASDAQ,TRUE,FALSE,TRUE
JBLU,JetBlue Airways Corporation Common Stock,NASDAQ,TRUE,TRUE,TRUE
JBI,Janus International Group, Inc.,NYSE,TRUE,TRUE,TRUE
EPWK,EPWK Holdings Ltd. Class A Ordinary Shares,NASDAQ,TRUE,FALSE,TRUE
JBHT,J.B. Hunt Transport Services, Inc. Common Stock,NASDAQ,TRUE,TRUE,TRUE
JAZZ,Jazz Pharmaceuticals plc Common Stock (Ireland),NASDAQ,TRUE,TRUE,TRUE
JAMF,Jamf Holding Corp. Common Stock,NASDAQ,TRUE,TRUE,TRUE
JACK,Jack In The Box Inc. Common Stock,NASDAQ,TRUE,TRUE,TRUE
J,Jacobs Solutions Inc.,NYSE,TRUE,TRUE,TRUE
IZEA,IZEA Worldwide, Inc. Common Stock,NASDAQ,TRUE,TRUE,TRUE
CNF,CNFinance Holdings Limited American Depositary Shares, each representing twenty (20) Ordinary Shares,NYSE,TRUE,FALSE,TRUE
IXUS,iShares Core MSCI Total International Stock ETF,NASDAQ,TRUE,TRUE,TRUE
BHF,Brighthouse Financial, Inc. Common Stock,NASDAQ,TRUE,TRUE,TRUE
IX,ORIX Corporation American Depositary Shares (each representing One (1) Share of Common Stock),NYSE,TRUE,TRUE,TRUE
BCX,BLACKROCK RESOURCES & COMMODITIES STRATEGY TRUST,NYSE,TRUE,FALSE,TRUE
IVT,InvenTrust Properties Corp.,NYSE,TRUE,TRUE,TRUE
CNEY,CN Energy Group Inc. Class A Ordinary Shares,NASDAQ,TRUE,FALSE,TRUE
IVR,Invesco Mortgage Capital Inc.,NYSE,TRUE,TRUE,TRUE
EPSM,Epsium Enterprise Limited Ordinary Shares,NASDAQ,TRUE,FALSE,TRUE
BHC,Bausch Health Companies Inc,NYSE,TRUE,TRUE,TRUE
HWAY,Themes ETF Trust Themes US Infrastructure ETF,NASDAQ,TRUE,FALSE,TRUE
IVAL,EA Series Trust Alpha Architect International Quantitative Value ETF,NASDAQ,TRUE,TRUE,TRUE
IUSV,iShares Core S&P U.S. Value ETF,NASDAQ,TRUE,TRUE,TRUE
IUSG,iShares Core S&P U.S. Growth ETF,NASDAQ,TRUE,TRUE,TRUE
IUSB,iShares Core Total USD Bond Market ETF,NASDAQ,TRUE,TRUE,TRUE
ITW,Illinois Tool Works Inc.,NYSE,TRUE,TRUE,TRUE
ITUB,Itau Unibanco Holding S.A. American Depositary Shares,NYSE,TRUE,TRUE,TRUE
ITRN,Ituran Location and Control Ltd. Ordinary Shares,NASDAQ,TRUE,TRUE,TRUE
ITRI,Itron, Inc. Common Stock,NASDAQ,TRUE,TRUE,TRUE
ITOS,iTeos Therapeutics, Inc. Common Stock,NASDAQ,TRUE,TRUE,TRUE
IT,Gartner, Inc.,NYSE,TRUE,TRUE,TRUE
ISTR,Investar Holding Corporation Common Stock,NASDAQ,TRUE,TRUE,TRUE
ISTB,iShares Core 1-5 Year USD Bond ETF,NASDAQ,TRUE,TRUE,TRUE
ISSC,Innovative Solutions and Support, Inc. Common Stock,NASDAQ,TRUE,TRUE,TRUE
ISRG,Intuitive Surgical, Inc. Common Stock,NASDAQ,TRUE,TRUE,TRUE
ISPR,Ispire Technology Inc. Common Stock,NASDAQ,TRUE,TRUE,TRUE
IRT,Independence Realty Trust Inc.,NYSE,TRUE,TRUE,TRUE
IRON,Disc Medicine, Inc. Common Stock,NASDAQ,TRUE,TRUE,TRUE
IRM,Iron Mountain Inc.,NYSE,TRUE,TRUE,TRUE
IRIX,IRIDEX Corporation Common Stock,NASDAQ,TRUE,TRUE,TRUE
IREN,IREN Limited Ordinary Shares,NASDAQ,TRUE,TRUE,TRUE
IRDM,Iridium Communications Inc Common Stock,NASDAQ,TRUE,TRUE,TRUE
IRD,Opus Genetics, Inc. Common Stock,NASDAQ,TRUE,TRUE,TRUE
IPM,Intelligent Protection Management Corp. Common Stock,NASDAQ,TRUE,FALSE,TRUE
IPKW,Invesco Exchange-Traded Fund Trust II Invesco International BuyBack Achievers ETF,NASDAQ,TRUE,FALSE,TRUE
IRBT,iRobot Corporation Common Stock,NASDAQ,TRUE,TRUE,TRUE
IR,Ingersoll Rand Inc. Common Stock,NYSE,TRUE,TRUE,TRUE
IQ,iQIYI, Inc. American Depositary Shares,NASDAQ,TRUE,TRUE,TRUE
IPWR,Ideal Power Inc. Common Stock,NASDAQ,TRUE,TRUE,TRUE
IPGP,IPG Photonics Corporation Common Stock,NASDAQ,TRUE,TRUE,TRUE
IPG,The Interpublic Group of Companies, Inc.,NYSE,TRUE,TRUE,TRUE
IPAR,Interparfums, Inc. Common Stock,NASDAQ,TRUE,TRUE,TRUE
IP,International Paper Co.,NYSE,TRUE,TRUE,TRUE
BGSF,BGSF, Inc.,NYSE,TRUE,TRUE,TRUE
IOVA,Iovance Biotherapeutics, Inc. Common Stock,NASDAQ,TRUE,TRUE,TRUE
IPHA,Innate Pharma S.A. ADS,NASDAQ,TRUE,FALSE,TRUE
IPDN,Professional Diversity Network, Inc. Common Stock,NASDAQ,TRUE,FALSE,TRUE
IONS,Ionis Pharmaceuticals, Inc. Common Stock,NASDAQ,TRUE,TRUE,TRUE
IONQ,IonQ, Inc.,NYSE,TRUE,TRUE,TRUE
INZY,Inozyme Pharma, Inc. Common Stock,NASDAQ,TRUE,TRUE,TRUE
INVH,Invitation Homes Inc. Common Stock,NYSE,TRUE,TRUE,TRUE
INVE,Identiv, Inc. Common Stock,NASDAQ,TRUE,TRUE,TRUE
INVA,Innoviva, Inc. Common Stock,NASDAQ,TRUE,TRUE,TRUE
INTU,Intuit Inc. Common Stock,NASDAQ,TRUE,TRUE,TRUE
INTR,Inter & Co. Inc. Class A Common Shares,NASDAQ,TRUE,TRUE,TRUE
INTC,Intel Corporation Common Stock,NASDAQ,TRUE,TRUE,TRUE
INTA,Intapp, Inc. Common Stock,NASDAQ,TRUE,TRUE,TRUE
HVT.A,Haverty Furniture Companies, Inc. Class A,NYSE,TRUE,FALSE,TRUE
INSW,International Seaways, Inc. Common Stock,NYSE,TRUE,TRUE,TRUE
BCTXZ,BriaCell Therapeutics Corp. Warrant,NASDAQ,TRUE,FALSE,TRUE
INSP,Inspire Medical Systems, Inc.,NYSE,TRUE,TRUE,TRUE
IPCXU,Inflection Point Acquisition Corp. III Units,NASDAQ,TRUE,FALSE,TRUE
INSM,Insmed Incorporated Common Stock,NASDAQ,TRUE,TRUE,TRUE
INSG,Inseego Corp. Common Stock,NASDAQ,TRUE,TRUE,TRUE
BCTXW,BriaCell Therapeutics Corp. Warrant,NASDAQ,TRUE,FALSE,TRUE
INSE,Inspired Entertainment, Inc. Common Stock,NASDAQ,TRUE,TRUE,TRUE
INOD,Innodata Inc. Common Stock,NASDAQ,TRUE,TRUE,TRUE
INO,Inovio Pharmaceuticals, Inc. Common Stock,NASDAQ,TRUE,TRUE,TRUE
INNV,InnovAge Holding Corp. Common Stock,NASDAQ,TRUE,TRUE,TRUE
INN,Summit Hotel Properties, Inc.,NYSE,TRUE,TRUE,TRUE
INMD,InMode Ltd. Ordinary Shares,NASDAQ,TRUE,TRUE,TRUE
INGN,Inogen, Inc Common Stock,NASDAQ,TRUE,TRUE,TRUE
ING,ING Groep N.V. American Depositary Shares,NYSE,TRUE,TRUE,TRUE
IPB,Merrill Lynch Depositor Inc. 6.0518% Index Plus Trust Certificates Series 2003-1,NYSE,TRUE,FALSE,TRUE
INFY,Infosys Limited American Depositary Shares,NYSE,TRUE,TRUE,TRUE
INFA,Informatica Inc.,NYSE,TRUE,TRUE,TRUE
INDY,iShares India 50 ETF,NASDAQ,TRUE,TRUE,TRUE
INDV,Indivior PLC Ordinary Shares,NASDAQ,TRUE,TRUE,TRUE
INDB,Independent Bank Corp. Common Stock,NASDAQ,TRUE,TRUE,TRUE
INCY,Incyte Corp. Common Stock,NASDAQ,TRUE,TRUE,TRUE
INBX,Inhibrx Biosciences, Inc. Common Stock,NASDAQ,TRUE,TRUE,TRUE
INBK,First Internet Bancorp Common Stock,NASDAQ,TRUE,TRUE,TRUE
IMXI,International Money Express, Inc. Common Stock,NASDAQ,TRUE,TRUE,TRUE
IPA,ImmunoPrecise Antibodies Ltd. Common Stock,NASDAQ,TRUE,FALSE,TRUE
BGS,B&G Foods, Inc.,NYSE,TRUE,TRUE,TRUE
IMVT,Immunovant, Inc. Common Stock,NASDAQ,TRUE,TRUE,TRUE
IMTX,Immatics N.V. Ordinary Shares,NASDAQ,TRUE,TRUE,TRUE
IMNM,Immunome, Inc. Common Stock,NASDAQ,TRUE,TRUE,TRUE
IMMX,Immix Biopharma, Inc. Common Stock,NASDAQ,TRUE,TRUE,TRUE
IMMR,Immersion Corporation Common Stock,NASDAQ,TRUE,TRUE,TRUE
BGFV,Big 5 Sporting Goods Corporation Common Stock,NASDAQ,TRUE,TRUE,TRUE
IMKTA,Ingles Markets, Incorporated Class A Common Stock,NASDAQ,TRUE,TRUE,TRUE
IMCV,iShares Morningstar Mid-Cap Value ETF,NASDAQ,TRUE,TRUE,TRUE
IMCR,Immunocore Holdings plc American Depositary Shares,NASDAQ,TRUE,TRUE,TRUE
CNDT,Conduent Incorporated Common Stock,NASDAQ,TRUE,FALSE,TRUE
IMAX,Imax Corp,NYSE,TRUE,TRUE,TRUE
HVIIU,Hennessy Capital Investment Corp. VII Unit,NASDAQ,TRUE,FALSE,TRUE
ILPT,Industrial Logistics Properties Trust Common Shares of Beneficial Interest,NASDAQ,TRUE,TRUE,TRUE
ILMN,Illumina, Inc. Common Stock,NASDAQ,TRUE,TRUE,TRUE
IJT,iShares S&P SmallCap 600 Growth ETF,NASDAQ,TRUE,TRUE,TRUE
IOTR,iOThree Limited Ordinary Shares,NASDAQ,TRUE,FALSE,TRUE
BGC,BGC Group, Inc. Class A Common Stock,NASDAQ,TRUE,TRUE,TRUE
BG,Bunge Global SA,NYSE,TRUE,TRUE,TRUE
IIPR,Innovative Industrial Properties, Inc. Common stock,NYSE,TRUE,TRUE,TRUE
IIIN,Insteel Industries, Inc.,NYSE,TRUE,TRUE,TRUE
III,Information Services Group Inc. Common Stock,NASDAQ,TRUE,TRUE,TRUE
HVIIR,Hennessy Capital Investment Corp. VII Rights,NASDAQ,TRUE,FALSE,TRUE
IHRT,iHeartMedia, Inc. Class A Common Stock,NASDAQ,TRUE,TRUE,TRUE
HVII,Hennessy Capital Investment Corp. VII Ordinary Shares,NASDAQ,TRUE,FALSE,TRUE
IHD,VOYA EMERGING MARKETS HIGH INCOME DIVIDEND EQUITY FUND,NYSE,TRUE,TRUE,TRUE
BFZ,BLACKROCK CA MUNICIPAL INC TR,NYSE,TRUE,TRUE,TRUE
IGT,International Game Technology PLC,NYSE,TRUE,TRUE,TRUE
BFST,Business First Bancshares, Inc. Common Stock,NASDAQ,TRUE,TRUE,TRUE
CSV,Carriage Services, Inc.,NYSE,TRUE,TRUE,TRUE
IGSB,iShares Trust iShares 1-5 Year Investment Grade Corporate Bond ETF,NASDAQ,TRUE,TRUE,TRUE
BFLY,Butterfly Network, Inc.,NYSE,TRUE,TRUE,TRUE
BFH,Bread Financial Holdings, Inc.,NYSE,TRUE,TRUE,TRUE
IGIB,iShares Trust iShares 5-10 Year Investment Grade Corporate Bond ETF,NASDAQ,TRUE,TRUE,TRUE
IGF,iShares Global Infrastructure ETF,NASDAQ,TRUE,TRUE,TRUE
IGD,VOYA GLOBAL EQUITY DIVIDEND AND PREMIUM OPPORTUNITY FUND,NYSE,TRUE,TRUE,TRUE
IFF,International Flavors & Fragrances Inc.,NYSE,TRUE,TRUE,TRUE
IEX,IDEX Corporation,NYSE,TRUE,TRUE,TRUE
EPRX,Eupraxia Pharmaceuticals Inc. Common Stock,NASDAQ,TRUE,FALSE,TRUE
IESC,IES Holdings, Inc. Common Stock,NASDAQ,TRUE,TRUE,TRUE
IEI,iShares 3-7 Year Treasury Bond ETF,NASDAQ,TRUE,TRUE,TRUE
IONX,Tidal Trust II Defiance Daily Target 2X Long IONQ ETF,NASDAQ,TRUE,FALSE,TRUE
IONR,ioneer Ltd American Depositary Shares,NASDAQ,TRUE,FALSE,TRUE
IEF,iShares 7-10 Year Treasury Bond ETF,NASDAQ,TRUE,TRUE,TRUE
IDYA,IDEAYA Biosciences, Inc. Common Stock,NASDAQ,TRUE,TRUE,TRUE
IONL,GraniteShares ETF Trust GraniteShares 2x Long IONQ Daily ETF,NASDAQ,TRUE,FALSE,TRUE
IDXX,IDEXX Laboratories, Inc. Common Stock,NASDAQ,TRUE,TRUE,TRUE
CNCR,ETF Series Solutions Trust Range Cancer Therapeutics ETF,NASDAQ,TRUE,FALSE,TRUE
IDT,IDT Corporation Class B,NYSE,TRUE,TRUE,TRUE
IDCC,InterDigital, Inc. Common Stock,NASDAQ,TRUE,TRUE,TRUE
BFAM,BRIGHT HORIZONS FAMILY SOLUTIONS INC.,NYSE,TRUE,TRUE,TRUE
SFBC,Sound Financial Bancorp, Inc. Common Stock,NASDAQ,TRUE,TRUE,TRUE
RMT,Royce Micro-Cap Trust Inc,NYSE,TRUE,TRUE,TRUE
BETR,Better Home & Finance Holding Company Class A Common Stock,NASDAQ,TRUE,TRUE,TRUE
SA,Seabridge Gold, Inc.,NYSE,TRUE,TRUE,TRUE
RSG,Republic Services Inc.,NYSE,TRUE,TRUE,TRUE
JOBY,Joby Aviation, Inc.,NYSE,TRUE,TRUE,TRUE
RMR,The RMR Group Inc. Class A Common Stock,NASDAQ,TRUE,TRUE,TRUE
PII,Polaris Inc.,NYSE,TRUE,TRUE,TRUE
RES,RPC, Inc.,NYSE,TRUE,TRUE,TRUE
LINE,Lineage, Inc. Common Stock,NASDAQ,TRUE,TRUE,TRUE
OC,Owens Corning,NYSE,TRUE,TRUE,TRUE
LPX,Louisiana-Pacific Corp.,NYSE,TRUE,TRUE,TRUE
INVZW,Innoviz Technologies Ltd. Warrant,NASDAQ,TRUE,FALSE,TRUE
OLO,Olo Inc.,NYSE,TRUE,TRUE,TRUE
RH,RH,NYSE,TRUE,TRUE,TRUE
PAY,Paymentus Holdings, Inc.,NYSE,TRUE,TRUE,TRUE
MG,Mistras Group Inc.,NYSE,TRUE,TRUE,TRUE
LPG,DORIAN LPG LTD,NYSE,TRUE,TRUE,TRUE
INVZ,Innoviz Technologies Ltd. Ordinary shares,NASDAQ,TRUE,FALSE,TRUE
BCTX,BriaCell Therapeutics Corp. Common Shares,NASDAQ,TRUE,FALSE,TRUE
IFN,The India Fund, Inc.,NYSE,TRUE,TRUE,TRUE
TEF,Telefonica, S.A.,NYSE,TRUE,TRUE,TRUE
STAG,STAG INDUSTRIAL, INC.,NYSE,TRUE,TRUE,TRUE
ONON,On Holding AG,NYSE,TRUE,TRUE,TRUE
INV,Innventure, Inc. Common Stock,NASDAQ,TRUE,FALSE,TRUE
INTZ,Intrusion Inc. Common Stock,NASDAQ,TRUE,FALSE,TRUE
INTW,GraniteShares ETF Trust GraniteShares 2x Long INTC Daily ETF,NASDAQ,TRUE,FALSE,TRUE
ITT,ITT Inc.,NYSE,TRUE,TRUE,TRUE
RTX,RTX Corporation,NYSE,TRUE,TRUE,TRUE
LAW,CS Disco, Inc.,NYSE,TRUE,TRUE,TRUE
KMX,CarMax Inc.,NYSE,TRUE,TRUE,TRUE
HUMAW,Humacyte, Inc. Warrant,NASDAQ,TRUE,FALSE,TRUE
RNG,RINGCENTRAL, INC.,NYSE,TRUE,TRUE,TRUE
INTJ,Intelligent Group Limited Class A Ordinary Shares,NASDAQ,TRUE,FALSE,TRUE
HUMA,Humacyte, Inc. Common Stock,NASDAQ,TRUE,FALSE,TRUE
KRMN,Karman Holdings Inc.,NYSE,TRUE,TRUE,TRUE
JBL,Jabil Inc.,NYSE,TRUE,TRUE,TRUE
HUIZ,Huize Holding Limited American Depositary Shares,NASDAQ,TRUE,FALSE,TRUE
JMSB,John Marshall Bancorp, Inc. Common Stock,NASDAQ,TRUE,TRUE,TRUE
BCLO,BlackRock ETF Trust II iShares BBB-B CLO Active ETF,NASDAQ,TRUE,FALSE,TRUE
PAM,PAMPA ENERGIA S.A.,NYSE,TRUE,TRUE,TRUE
LDI,loanDepot, Inc.,NYSE,TRUE,TRUE,TRUE
K,Kellanova,NYSE,TRUE,TRUE,TRUE
INTG,Intergroup Corporation (The) Common Stock,NASDAQ,TRUE,FALSE,TRUE
TBBB,BBB Foods Inc.,NYSE,TRUE,TRUE,TRUE
PRVA,Privia Health Group, Inc. Common Stock,NASDAQ,TRUE,TRUE,TRUE
T,AT&T Inc.,NYSE,TRUE,TRUE,TRUE
SM,SM Energy Company,NYSE,TRUE,TRUE,TRUE
PWR,Quanta Services, Inc.,NYSE,TRUE,TRUE,TRUE
BEPC,Brookfield Renewable Corporation Class A Exchangeable Subordinate Voting Shares,NYSE,TRUE,TRUE,TRUE
PPL,PPL Corporation,NYSE,TRUE,TRUE,TRUE
MCS,The Marcus Corporation,NYSE,TRUE,TRUE,TRUE
JCI,Johnson Controls International plc,NYSE,TRUE,TRUE,TRUE
SLAB,Silicon Laboratories, Inc. Common Stock,NASDAQ,TRUE,TRUE,TRUE
PUMP,ProPetro Holding Corp.,NYSE,TRUE,TRUE,TRUE
INRO,BlackRock ETF Trust iShares U.S. Industry Rotation Active ETF,NASDAQ,TRUE,FALSE,TRUE
QGEN,QIAGEN N.V.,NYSE,TRUE,TRUE,TRUE
MYRG,MYR Group, Inc. Common Stock,NASDAQ,TRUE,TRUE,TRUE
LCII,LCI Industries,NYSE,TRUE,TRUE,TRUE
CMU,MFS High Yield Municipal Trust,NYSE,TRUE,FALSE,TRUE
KNSA,Kiniksa Pharmaceuticals International, plc Class A Ordinary Shares,NASDAQ,TRUE,TRUE,TRUE
EPR.PRG,EPR Properties 5.750% Series G Cumulative Redeemable Preferred Shares,NYSE,TRUE,FALSE,TRUE
JBTM,JBT Marel Corporation,NYSE,TRUE,TRUE,TRUE
BEP,Brookfield Renewable Partners L.P.,NYSE,TRUE,TRUE,TRUE
TILE,Interface, Inc. Common Stock,NASDAQ,TRUE,TRUE,TRUE
THRM,Gentherm Inc Common Stock,NASDAQ,TRUE,TRUE,TRUE
THRD,Third Harmonic Bio, Inc. Common Stock,NASDAQ,TRUE,TRUE,TRUE
TECX,Tectonic Therapeutic, Inc. Common Stock,NASDAQ,TRUE,TRUE,TRUE
TEAF,Tortoise Sustainable and Social Impact Term Fund,NYSE,TRUE,TRUE,TRUE
TCX,Tucows Inc. Class A Common Stock,NASDAQ,TRUE,TRUE,TRUE
TBRG,TruBridge, Inc. Common Stock,NASDAQ,TRUE,TRUE,TRUE
HUHU,HUHUTECH International Group Inc. Ordinary Shares,NASDAQ,TRUE,FALSE,TRUE
TBBK,The Bancorp Inc Common Stock,NASDAQ,TRUE,TRUE,TRUE
EPR.PRE,EPR Properties 9.00% Series E Cumulative Convertible Preferred Shares,NYSE,TRUE,FALSE,TRUE
SYBT,Stock Yards Bancorp, Inc. Common Stock,NASDAQ,TRUE,TRUE,TRUE
SXT,Sensient Technology Corporation,NYSE,TRUE,TRUE,TRUE
BELFB,Bel Fuse Inc. Class B Common Stock,NASDAQ,TRUE,TRUE,TRUE
SXI,Standex International Corporation,NYSE,TRUE,TRUE,TRUE
SWKH,SWK Holdings Corporation Common Stock,NASDAQ,TRUE,TRUE,TRUE
