Symbol,Name,Exchange,Tradable,Shortable,Marginable
OACCW,Oaktree Acquisition Corp. III Life Sciences Warrant,NASDAQ,TRUE,FALSE,TRUE
ESTA,Establishment Labs Holdings Inc. Common Shares,NASDAQ,TRUE,TRUE,TRUE
OACCU,Oaktree Acquisition Corp. III Life Sciences Unit,NASDAQ,TRUE,FALSE,TRUE
FRBA,First Bank Common Stock,NASDAQ,TRUE,TRUE,TRUE
OACC,Oaktree Acquisition Corp. III Life Sciences Class A Ordinary Share,NASDAQ,TRUE,FALSE,TRUE
OABIW,OmniAb, Inc. Warrant,NASDAQ,TRUE,FALSE,TRUE
ESS,Essex Property Trust, Inc,NYSE,TRUE,TRUE,TRUE
ESRT,EMPIRE STATE REALTY TRUST, INC.,NYSE,TRUE,TRUE,TRUE
BOEU,Direxion Shares ETF Trust Direxion Daily BA Bull 2X Shares,NASDAQ,TRUE,FALSE,TRUE
BOED,Direxion Shares ETF Trust Direxion Daily BA Bear 1X Shares,NASDAQ,TRUE,FALSE,TRUE
NZUS,SPDR Series Trust SPDR MSCI USA Climate Paris Aligned ETF,NASDAQ,TRUE,FALSE,TRUE
BOE,BlackRock Enhanced Global Dividend Trust,NYSE,TRUE,FALSE,TRUE
NZAC,SPDR MSCI ACWI Climate Paris Aligned ETF,NASDAQ,TRUE,FALSE,TRUE
NYXH,Nyxoah SA Ordinary Shares,NASDAQ,TRUE,FALSE,TRUE
FMB,First Trust Exchange-Traded Fund III First Trust Managed Municipal ETF,NASDAQ,TRUE,FALSE,TRUE
ALTO,Alto Ingredients, Inc. Common Stock,NASDAQ,TRUE,FALSE,TRUE
ESOA,Energy Services of America Corporation Common Stock,NASDAQ,TRUE,TRUE,TRUE
ESNT,Essent Group LTD,NYSE,TRUE,TRUE,TRUE
NYMTZ,New York Mortgage Trust, Inc. 7.000% Series G Cumulative Redeemable Preferred Stock, $0.01 par value per share,NASDAQ,TRUE,FALSE,TRUE
ATNF,180 Life Sciences Corp. Common Stock,NASDAQ,TRUE,FALSE,TRUE
NYMTN,New York Mortgage Trust, Inc. 8.00% Series D Fixed-to-Floating Rate Cumulative Redeemable Preferred Stock,NASDAQ,TRUE,FALSE,TRUE
NYMTM,New York Mortgage Trust, Inc. 7.875% Series E Fixed-to-Floating Rate Cumulative Redeemable Preferred Stock,NASDAQ,TRUE,FALSE,TRUE
FNY,First Trust Mid Cap Growth AlphaDEX Fund,NASDAQ,TRUE,TRUE,TRUE
NYMTL,New York Mortgage Trust, Inc. 6.875% Series F Fixed-to-Floating Rate Cumulative Redeemable Preferred Stock, $0.01 par value per share,NASDAQ,TRUE,FALSE,TRUE
ESI,Element Solutions Inc.,NYSE,TRUE,TRUE,TRUE
NYMTI,New York Mortgage Trust, Inc. 9.125% Senior Notes Due 2029,NASDAQ,TRUE,FALSE,TRUE
ESGU,iShares Trust iShares ESG Aware MSCI USA ETF,NASDAQ,TRUE,TRUE,TRUE
FMUN,Fidelity Merrimack Street Trust Fidelity Systematic Municipal Bond Index ETF,NASDAQ,TRUE,TRUE,TRUE
NYMTG,New York Mortgage Trust, Inc. 9.125% Senior Notes Due 2030,NASDAQ,TRUE,FALSE,TRUE
ESGE,iShares, Inc. iShares ESG Aware MSCI EM ETF,NASDAQ,TRUE,TRUE,TRUE
FDNI,First Trust Exchange-Traded Fund II First Trust Dow Jones International Internet ETF,NASDAQ,TRUE,TRUE,TRUE
ESGD,iShares Trust iShares ESG Aware MSCI EAFE ETF,NASDAQ,TRUE,TRUE,TRUE
BNZIW,Banzai International, Inc. Warrant,NASDAQ,TRUE,FALSE,TRUE
ESCA,Escalade, Incorporated Common Stock,NASDAQ,TRUE,TRUE,TRUE
NYC,American Strategic Investment Co.,NYSE,TRUE,FALSE,TRUE
NYAX,Nayax Ltd. Ordinary Shares,NASDAQ,TRUE,FALSE,TRUE
FATE,Fate Therapeutics, Inc. Common Stock,NASDAQ,TRUE,TRUE,TRUE
BNZI,Banzai International, Inc. Class A Common Stock,NASDAQ,TRUE,FALSE,TRUE
ES,Eversource Energy,NYSE,TRUE,TRUE,TRUE
NXXT,NextNRG, Inc. Common Stock,NASDAQ,TRUE,FALSE,TRUE
ERO,Ero Copper Corp.,NYSE,TRUE,TRUE,TRUE
BNY,BlackRock New York Municipal Income Trust,NYSE,TRUE,FALSE,TRUE
ERII,Energy Recovery, Inc. Common Stock,NASDAQ,TRUE,TRUE,TRUE
ERIE,Erie Indemnity Company Class A Common Stock,NASDAQ,TRUE,TRUE,TRUE
NXTG,First Trust Indxx NextG ETF,NASDAQ,TRUE,FALSE,TRUE
NXPLW,NextPlat Corp Warrants,NASDAQ,TRUE,FALSE,TRUE
EQT,EQT CORP,NYSE,TRUE,TRUE,TRUE
ERIC,Ericsson American Depositary Shares,NASDAQ,TRUE,TRUE,TRUE
ATMVU,AlphaVest Acquisition Corp Unit,NASDAQ,TRUE,FALSE,TRUE
NXPL,NextPlat Corp Common Stock,NASDAQ,TRUE,FALSE,TRUE
NXP,NUVEEN SELECT TAX-FREE INC,NYSE,TRUE,FALSE,TRUE
ERAS,Erasca, Inc. Common Stock,NASDAQ,TRUE,TRUE,TRUE
ESLT,Elbit Systems Ltd. Ordinary Shares,NASDAQ,TRUE,TRUE,TRUE
EQBK,Equity Bancshares, Inc.,NYSE,TRUE,TRUE,TRUE
NXN,NUVEEN NY SEL TAX-FREE INC,NYSE,TRUE,FALSE,TRUE
NXL,Nexalin Technology, Inc. Common Stock,NASDAQ,TRUE,FALSE,TRUE
NXJ,Nuveen New Jersey Quality Municipal Income Fund,NYSE,TRUE,FALSE,TRUE
NXG,NXG NextGen Infrastructure Income Fund,NYSE,TRUE,FALSE,TRUE
NXDT.PRA,NexPoint Diversified Real Estate Trust 5.50% Series A Cumulative Preferred Shares ($25.00 liquidation preference per share),NYSE,TRUE,FALSE,TRUE
DHF,BNY Mellon High Yield Strategies Fund,NYSE,TRUE,FALSE,TRUE
BNRG,Brenmiller Energy Ltd Ordinary Shares,NASDAQ,TRUE,FALSE,TRUE
ENZL,iShares Trust iShares MSCI New Zealand ETF,NASDAQ,TRUE,TRUE,TRUE
NXC,NUVEEN CA SEL TAX-FREE INC,NYSE,TRUE,FALSE,TRUE
NWTNW,NWTN Inc. Warrant,NASDAQ,TRUE,FALSE,TRUE
HLI,Houlihan Lokey, Inc.,NYSE,TRUE,TRUE,TRUE
BNR,Burning Rock Biotech Limited American Depositary Shares,NASDAQ,TRUE,FALSE,TRUE
NWTN,NWTN Inc. Class B Ordinary Shares,NASDAQ,TRUE,FALSE,TRUE
NWTG,Newton Golf Company, Inc. Common Stock,NASDAQ,TRUE,FALSE,TRUE
EQV,EQV Ventures Acquisition Corp.,NYSE,TRUE,TRUE,TRUE
EQR,Equity Residential,NYSE,TRUE,TRUE,TRUE
DHCNL,Diversified Healthcare Trust 6.25% Senior Notes Due 2046,NASDAQ,TRUE,FALSE,TRUE
EQIX,Equinix, Inc. Common Stock REIT,NASDAQ,TRUE,TRUE,TRUE
NWGL,Nature Wood Group Limited American Depositary Shares,NASDAQ,TRUE,FALSE,TRUE
EQH.PRC,Equitable Holdings, Inc. Depositary Shares, each representing a 1/1, 000th interest in a share of Fixed Rate Noncumulative Perpetual Preferred Stock, Series C,NYSE,TRUE,TRUE,TRUE
NVYY,GraniteShares ETF Trust GraniteShares YieldBOOST NVDA ETF,NASDAQ,TRUE,FALSE,TRUE
EQH,Equitable Holdings, Inc.,NYSE,TRUE,TRUE,TRUE
DHCNI,Diversified Healthcare Trust 5.625% Senior Notes due 2042,NASDAQ,TRUE,FALSE,TRUE
NVVEW,Nuvve Holding Corp. Warrant,NASDAQ,TRUE,FALSE,TRUE
EPSN,Epsilon Energy Ltd. Common Share,NASDAQ,TRUE,TRUE,TRUE
EPRT,Essential Properties Realty Trust, Inc.,NYSE,TRUE,TRUE,TRUE
NVVE,Nuvve Holding Corp. Common Stock,NASDAQ,TRUE,FALSE,TRUE
EPR,EPR Properties,NYSE,TRUE,TRUE,TRUE
DHAIW,DIH Holding US, Inc. Warrants,NASDAQ,TRUE,FALSE,TRUE
NVNIW,Nvni Group Limited Warrants,NASDAQ,TRUE,FALSE,TRUE
NVG,Nuveen AMT-Free Municipal Credit Income Fund,NYSE,TRUE,FALSE,TRUE
NVFY,Nova Lifestyle, Inc. Common Stock,NASDAQ,TRUE,FALSE,TRUE
DHAI,DIH Holdings US, Inc. Class A Common Stock,NASDAQ,TRUE,FALSE,TRUE
DHIL,Diamond Hill Investment Group, Inc. Class A Common Stock,NASDAQ,TRUE,TRUE,TRUE
NVDU,Direxion Shares ETF Trust Direxion Daily NVDA Bull 2X Shares,NASDAQ,TRUE,FALSE,TRUE
NVDS,Investment Managers Series Trust II Tradr 1.5X Short NVDA Daily ETF,NASDAQ,TRUE,FALSE,TRUE
FLYE,Fly-E Group, Inc. Common Stock,NASDAQ,TRUE,FALSE,TRUE
EPD,Enterprise Products Partners L.P.,NYSE,TRUE,TRUE,TRUE
NVDL,GraniteShares ETF Trust GraniteShares 2x Long NVDA Daily ETF,NASDAQ,TRUE,FALSE,TRUE
NVDG,Themes ETF Trust Leverage Shares 2X Long NVDA Daily ETF,NASDAQ,TRUE,FALSE,TRUE
EPC,Edgewell Personal Care Company,NYSE,TRUE,TRUE,TRUE
EPAM,EPAM SYSTEMS, INC.,NYSE,TRUE,TRUE,TRUE
NVDD,Direxion Shares ETF Trust Direxion Daily NVDA Bear 1X Shares,NASDAQ,TRUE,FALSE,TRUE
NVD,GraniteShares ETF Trust GraniteShares 2x Short NVDA Daily ETF,NASDAQ,TRUE,FALSE,TRUE
DERM,Journey Medical Corporation Common Stock,NASDAQ,TRUE,TRUE,TRUE
NVCT,Nuvectis Pharma, Inc. Common Stock,NASDAQ,TRUE,FALSE,TRUE
EOG,EOG Resources, Inc.,NYSE,TRUE,TRUE,TRUE
ENVA,Enova International, Inc.,NYSE,TRUE,TRUE,TRUE
BNJ,Brookfield Finance I (UK) plc 4.50% Perpetual Subordinated Notes,NYSE,TRUE,FALSE,TRUE
ENTG,Entegris, Inc. Common Stock,NASDAQ,TRUE,TRUE,TRUE
ENTA,Enanta Pharmaceuticals, Inc. Common Stock,NASDAQ,TRUE,TRUE,TRUE
DEC,Diversified Energy Company plc,NYSE,TRUE,TRUE,TRUE
ENSG,The Ensign Group, Inc. Common Stock,NASDAQ,TRUE,TRUE,TRUE
ENS,EnerSys, Inc.,NYSE,TRUE,TRUE,TRUE
BNH,Brookfield Finance Inc. 4.625% Subordinated Notes due October 16, 2080,NYSE,TRUE,FALSE,TRUE
BNGO,Bionano Genomics, Inc. Common Stock,NASDAQ,TRUE,FALSE,TRUE
DDL,Dingdong (Cayman) Limited American Depositary Shares (each two representing three Ordinary Shares),NYSE,TRUE,TRUE,TRUE
NVAWW,Nova Minerals Limited Warrant,NASDAQ,TRUE,FALSE,TRUE
FLX,BingEx Limited American Depositary Shares,NASDAQ,TRUE,FALSE,TRUE
ATMVR,AlphaVest Acquisition Corp Right.,NASDAQ,TRUE,FALSE,TRUE
DGXX,Digi Power X Inc. Subordinate Voting Shares,NASDAQ,TRUE,FALSE,TRUE
NVA,Nova Minerals Limited American Depositary Shares,NASDAQ,TRUE,FALSE,TRUE
ENR,Energizer Holdings, Inc,NYSE,TRUE,TRUE,TRUE
NUWE,Nuwellis, Inc. Common Stock,NASDAQ,TRUE,FALSE,TRUE
NUVB.WS,Nuvation Bio Inc. Redeemable warrants, each whole warrant exercisable for one share of Class A common stock at an exercise price of $11.50,NYSE,TRUE,FALSE,TRUE
NUTX,Nutex Health Inc. Common Stock,NASDAQ,TRUE,FALSE,TRUE
DGRE,WisdomTree Trust WisdomTree Emerging Markets Quality Dividend Growth Fund,NASDAQ,TRUE,FALSE,TRUE
ATMV,AlphaVest Acquisition Corp Ordinary Shares,NASDAQ,TRUE,FALSE,TRUE
ADCT,ADC Therapeutics SA,NYSE,TRUE,FALSE,TRUE
ENPH,Enphase Energy, Inc. Common Stock,NASDAQ,TRUE,TRUE,TRUE
ENOV,Enovis Corporation,NYSE,TRUE,TRUE,TRUE
ENIC,Enel Chile S.A. American Depositary Shares Representing Common Stock (Each representing 50 shares of Common Stock),NYSE,TRUE,TRUE,TRUE
DGICB,Donegal Group, Inc. Class B Common Stock,NASDAQ,TRUE,FALSE,TRUE
DADA,Dada Nexus Limited American Depositary Shares,NASDAQ,TRUE,TRUE,TRUE
NUSB,NuShares ETF Trust Nuveen Ultra Short Income ETF,NASDAQ,TRUE,FALSE,TRUE
CYD,China Yuchai International Ltd.,NYSE,TRUE,TRUE,TRUE
CURI,CuriosityStream Inc. Class A Common Stock,NASDAQ,TRUE,TRUE,TRUE
EMR,Emerson Electric Co.,NYSE,TRUE,TRUE,TRUE
EMN,Eastman Chemical Company,NYSE,TRUE,TRUE,TRUE
MNTN,MNTN, Inc.,NYSE,TRUE,FALSE,TRUE
NUKKW,Nukkleus Inc. Warrants,NASDAQ,TRUE,FALSE,TRUE
AGD,abrdn Global Dynamic Dividend Fund,NYSE,TRUE,FALSE,TRUE
EML,Eastern Company (The) Common Stock,NASDAQ,TRUE,TRUE,TRUE
NUKK,Nukkleus Inc. Common Stock,NASDAQ,TRUE,FALSE,TRUE
ADC.PRA,Agree Realty Corporation Depositary Shares, each representing 1/1,000th of a 4.250% Series A Cumulative Redeemable Preferred Stock,NYSE,TRUE,FALSE,TRUE
COMT,iShares U.S. ETF Trust iShares GSCI Commodity Dynamic Roll Strategy ETF,NASDAQ,TRUE,TRUE,TRUE
COFS,ChoiceOne Financial Services, Inc. Common Stock,NASDAQ,TRUE,TRUE,TRUE
AAM.WS,AA Mission Acquisition Corp. Warrants, each whole warrant entitles the holder to purchase one Class A ordinary share at a price of $11.50 per share,NYSE,TRUE,FALSE,TRUE
CION,CION Investment Corporation,NYSE,TRUE,TRUE,TRUE
BNAIW,Brand Engagement Network Inc. Warrant,NASDAQ,TRUE,FALSE,TRUE
CIO,CITY OFFICE REIT, INC.,NYSE,TRUE,TRUE,TRUE
EMBC,Embecta Corp. Common Stock,NASDAQ,TRUE,TRUE,TRUE
EMB,iShares J,P. Morgan USD Emerging Markets Bond ETF,NASDAQ,TRUE,TRUE,TRUE
ELV,Elevance Health, Inc.,NYSE,TRUE,TRUE,TRUE
BNAI,Brand Engagement Network Inc. Common Stock,NASDAQ,TRUE,FALSE,TRUE
FLNG,FLEX LNG Ltd. Ordinary Shares,NYSE,TRUE,FALSE,TRUE
ATMCW,AlphaTime Acquisition Corp Warrant,NASDAQ,TRUE,FALSE,TRUE
FLN,First Trust Latin America AlphaDEX Fund,NASDAQ,TRUE,FALSE,TRUE
ELTX,Elicio Therapeutics, Inc. Common Stock,NASDAQ,TRUE,TRUE,TRUE
CGV,Conductor Global Equity Value ETF,NYSE,TRUE,TRUE,TRUE
CGBD,Carlyle Secured Lending, Inc. Common Stock,NASDAQ,TRUE,TRUE,TRUE
NTWOW,Newbury Street II Acquisition Corp Warrant,NASDAQ,TRUE,FALSE,TRUE
ELS,Equity Lifestyle Properties, Inc.,NYSE,TRUE,TRUE,TRUE
BMRA,Biomerica, Inc. Common Stock,NASDAQ,TRUE,FALSE,TRUE
AAM.U,AA Mission Acquisition Corp. Units, each consisting of one Class A Ordinary Share and one-half of one redeemable warrant,NYSE,TRUE,FALSE,TRUE
NTWOU,Newbury Street II Acquisition Corp Unit,NASDAQ,TRUE,FALSE,TRUE
CGAU,Centerra Gold Inc.,NYSE,TRUE,TRUE,TRUE
NTWO,Newbury Street II Acquisition Corp Class A Ordinary Shares,NASDAQ,TRUE,FALSE,TRUE
NTRP,NextTrip, Inc. Common Stock,NASDAQ,TRUE,FALSE,TRUE
ELP,Companhia Paranaense de Energia - COPEL American Depositary Shares (each representing four (4) Class B Preferred Shares),NYSE,TRUE,TRUE,TRUE
ELME,Elme Communities,NYSE,TRUE,TRUE,TRUE
NTRBW,Nutriband Inc. Warrant,NASDAQ,TRUE,FALSE,TRUE
DGCB,Dimensional ETF Trust Dimensional Global Credit ETF,NASDAQ,TRUE,FALSE,TRUE
ELF,e.l.f. Beauty, Inc.,NYSE,TRUE,TRUE,TRUE
ELDN,Eledon Pharmaceuticals, Inc. Common Stock,NASDAQ,TRUE,TRUE,TRUE
NTRB,Nutriband Inc. Common Stock,NASDAQ,TRUE,FALSE,TRUE
ELAN,Elanco Animal Health Incorporated Common Stock,NYSE,TRUE,TRUE,TRUE
EL,The Estee Lauder Companies Inc. Class A,NYSE,TRUE,TRUE,TRUE
BMR,Beamr Imaging Ltd. Ordinary Share,NASDAQ,TRUE,FALSE,TRUE
IBTQ,iShares Trust iShares iBonds Dec 2035 Term Treasury ETF,NASDAQ,TRUE,FALSE,TRUE
NTHI,NeOnc Technologies Holdings, Inc. Common Stock,NASDAQ,TRUE,FALSE,TRUE
BMN,BlackRock 2037 Municipal Target Term Trust,NYSE,TRUE,FALSE,TRUE
NTCL,NETCLASS TECHNOLOGY INC Class A Ordinary Shares,NASDAQ,TRUE,FALSE,TRUE
EIX,Edison International,NYSE,TRUE,TRUE,TRUE
CDTX,Cidara Therapeutics, Inc. Common Stock,NASDAQ,TRUE,TRUE,TRUE
NSYS,Nortech Systems Incorporated Common Stock,NASDAQ,TRUE,FALSE,TRUE
NSPR,InspireMD Inc. Common Stock,NASDAQ,TRUE,FALSE,TRUE
EHTH,eHealth, Inc. Common Stock,NASDAQ,TRUE,TRUE,TRUE
EHC,Encompass Health Corporation Common Stock,NYSE,TRUE,TRUE,TRUE
NSI,Northern Lights Fund Trust IV National Security Emerging Markets Index ETF,NASDAQ,TRUE,FALSE,TRUE
NSA.PRB,National Storage Affiliates Trust 6.000% Series B Cumulative Redeemable Preferred Shares of Beneficial Interest,NYSE,TRUE,FALSE,TRUE
C.PRN,Citigroup Capital XIII 7.875% Fixed Rate/Floating Rate Trust Preferred Securities,NYSE,TRUE,TRUE,TRUE
ATMC,AlphaTime Acquisition Corp Ordinary Shares,NASDAQ,TRUE,FALSE,TRUE
JACS,Jackson Acquisition Company II,NYSE,TRUE,FALSE,TRUE
NSA.PRA,National Storage Affiliates Trust 6.000 Percent Series A Cumulative Redeemable Preferred Shares of Beneficial Interest (Liquidation Preference $25.00 per share),NYSE,TRUE,FALSE,TRUE
BML.PRL,Bank of America Depositary Shares(Each representing 1/1200th interest in a share of Bank of America Corporation Floating Rate Non-Comulative Preferred Stock, Series5),NYSE,TRUE,FALSE,TRUE
BWFG,Bankwell Financial Group, Inc. Common Stock,NASDAQ,TRUE,TRUE,TRUE
NRXPW,NRX Pharmaceuticals, Inc. Warrant,NASDAQ,TRUE,FALSE,TRUE
NRXP,NRX Pharmaceuticals, Inc. Common Stock,NASDAQ,TRUE,FALSE,TRUE
EHAB,Enhabit, Inc.,NYSE,TRUE,TRUE,TRUE
SEATW,Vivid Seats Inc. Warrant,NASDAQ,TRUE,FALSE,TRUE
NRUC,National Rural Utilities Cooperative Finance Corporation 5.500% Subordinated Notes due 2064 (Subordinated Deferrable Interest Notes),NYSE,TRUE,FALSE,TRUE
AFSC,abrdn Funds abrdn Focused U.S. Small Cap Active ETF,NASDAQ,TRUE,FALSE,TRUE
BVS,Bioventus Inc. Class A Common Stock,NASDAQ,TRUE,TRUE,TRUE
EH,EHang Holdings Limited ADS,NASDAQ,TRUE,TRUE,TRUE
EGY,Vaalco Energy, Inc.,NYSE,TRUE,TRUE,TRUE
EGO,Eldorado Gold Corporation,NYSE,TRUE,TRUE,TRUE
ACLO,TCW AAA CLO ETF,NYSE,TRUE,FALSE,TRUE
NRT,North European Oil Royalty Trust,NYSE,TRUE,FALSE,TRUE
BML.PRJ,Bank of America Depositary Shares(Each representing 1/1200th interest in a share of Bank of America Corporation Floating Rate Non-Cumulative Preferred Stock, Series4),NYSE,TRUE,FALSE,TRUE
NRSNW,NeuroSense Therapeutics Ltd. Warrant,NASDAQ,TRUE,FALSE,TRUE
EGHT,8x8 Inc Common Stock,NASDAQ,TRUE,TRUE,TRUE
NRSN,NeuroSense Therapeutics Ltd. Ordinary Shares,NASDAQ,TRUE,FALSE,TRUE
EGBN,Eagle Bancorp, Inc. Common Stock,NASDAQ,TRUE,TRUE,TRUE
DFP,FLAHERTY & CRUMRINE DYNAMIC PREFERRED AND INCOME FUND INCORPORATED,NYSE,TRUE,FALSE,TRUE
EGAN,eGain Corporation Common Stock,NASDAQ,TRUE,TRUE,TRUE
AFRIW,Forafric Global PLC Warrants,NASDAQ,TRUE,FALSE,TRUE
FLGC,Flora Growth Corp. Common Stock,NASDAQ,TRUE,FALSE,TRUE
EG,Everest Group, Ltd.,NYSE,TRUE,TRUE,TRUE
BML.PRH,Bank Of America Corporation Depositary Shares(Each representing a 1/1200th interest in a share of Bank of America Corporation Floating Rate Non-Cumulative Preferred Stock Series,2),NYSE,TRUE,FALSE,TRUE
NRK,Nuveen New York AMT-Free Quality Municipal Income Fund,NYSE,TRUE,FALSE,TRUE
BSMV,Invesco Exchange-Traded Self-Indexed Fund Trust Invesco BulletShares 2031 Municipal Bond ETF,NASDAQ,TRUE,TRUE,TRUE
NRGV,Energy Vault Holdings, Inc.,NYSE,TRUE,FALSE,TRUE
EFX,Equifax, Incorporated,NYSE,TRUE,TRUE,TRUE
FLG.PRU,Flagstar Financial, Inc. Bifurcated Option Note Unit SecuritiES,NYSE,TRUE,FALSE,TRUE
EFSC,Enterprise Financial Services Corporation Common Stock,NASDAQ,TRUE,TRUE,TRUE
ATLX,Atlas Lithium Corporation Common Stock,NASDAQ,TRUE,FALSE,TRUE
BOW,Bowhead Specialty Holdings Inc.,NYSE,TRUE,TRUE,TRUE
EFC,Ellington Financial Inc. Common Stock,NYSE,TRUE,TRUE,TRUE
ATLN,Atlantic International Corp. Common Stock,NASDAQ,TRUE,FALSE,TRUE
FLG.PRA,Flagstar Financial, Inc. Depositary shares, each representing a 1/40th interest in a share of Fixed-to-Floating Rate Series A Noncumulative Perpetual Preferred Stock,NYSE,TRUE,FALSE,TRUE
BLND,Blend Labs, Inc.,NYSE,TRUE,TRUE,TRUE
DFLIW,Dragonfly Energy Holdings Corp. Warrant,NASDAQ,TRUE,FALSE,TRUE
BML.PRG,Bank Of America Corporation Depositary Shares(Each representing a 1/1200th interest in a share of Bank of America Corporation Floating Rate Non-Cumulative Preferred Stock Series,1),NYSE,TRUE,FALSE,TRUE
NRES,DBX ETF Trust Xtrackers RREEF Global Natural Resources ETF,NASDAQ,TRUE,FALSE,TRUE
BCAX,Bicara Therapeutics Inc. Common Stock,NASDAQ,TRUE,TRUE,TRUE
NREF.PRA,NexPoint Real Estate Finance, Inc. 8.50% Series A Cumulative Redeemable Preferred Stock,NYSE,TRUE,FALSE,TRUE
BAND,Bandwidth Inc. Class A Common Stock,NASDAQ,TRUE,TRUE,TRUE
BAC.PRS,Bank of America Corporation Depositary shares, each representing 1/1,000th interest in a share of 4.750% Non-Cumulative Preferred Stock, Series SS,NYSE,TRUE,TRUE,TRUE
BMGL,Basel Medical Group Ltd Ordinary Shares,NASDAQ,TRUE,FALSE,TRUE
NQP,Nuveen Pennsylvania Quality Municipal Income Fund,NYSE,TRUE,FALSE,TRUE
NPWR.WS,NET Power Inc. Redeemable warrants, each whole warrant exercisable for one share of Class A Common Stock at an exercise price of $11.50,NYSE,TRUE,FALSE,TRUE
ADBG,Themes ETF Trust Leverage Shares 2X Long ADBE Daily ETF,NASDAQ,TRUE,FALSE,TRUE
NPV,Nuveen Virginia Quality Municipal Income Fund,NYSE,TRUE,FALSE,TRUE
MCI,Barings Corporate Investors,NYSE,TRUE,FALSE,TRUE
BAC.PRL,Bank Of America Corporation 7.25% Non-Cumulative Perpetual Convertible Preferred Stock, Series L,NYSE,TRUE,TRUE,TRUE
BAC.PRK,Bank of America Corporation Depositary Shares, each representing a 1/1,000th interest in a share of 5.875% Non- Cumulative Preferred Stock, Series HH,NYSE,TRUE,TRUE,TRUE
NPFI,NuShares ETF Trust Nuveen Preferred and Income ETF,NASDAQ,TRUE,FALSE,TRUE
AFRI,Forafric Global PLC Ordinary Shares,NASDAQ,TRUE,FALSE,TRUE
ATLCZ,Atlanticus Holdings Corporation 9.25% Senior Notes due 2029,NASDAQ,TRUE,FALSE,TRUE
EEX,Emerald Holding, Inc.,NYSE,TRUE,TRUE,TRUE
NPFD,Nuveen Variable Rate Preferred & Income Fund,NYSE,TRUE,FALSE,TRUE
NPCT,Nuveen Core Plus Impact Fund,NYSE,TRUE,FALSE,TRUE
AWP,abrdn Global Premier Properties Fund,NYSE,TRUE,TRUE,TRUE
AVNS,Avanos Medical, Inc.,NYSE,TRUE,TRUE,TRUE
AUDC,AudioCodes Ltd. Common Stock,NASDAQ,TRUE,TRUE,TRUE
FLDDW,Fold Holdings, Inc. Warrant,NASDAQ,TRUE,FALSE,TRUE
NPACU,New Providence Acquisition Corp. III Units,NASDAQ,TRUE,FALSE,TRUE
ATLCP,Atlanticus Holdings Corporation 7.625% Series B Cumulative Perpetual Preferred Stock, no par value per share,NASDAQ,TRUE,FALSE,TRUE
FLDB,Fidelity Merrimack Street Trust Fidelity Low Duration Bond ETF,NASDAQ,TRUE,FALSE,TRUE
AUBN,Auburn National Bancorporation, Inc. Common Stock,NASDAQ,TRUE,TRUE,TRUE
NOVA,Sunnova Energy International Inc.,NYSE,TRUE,FALSE,TRUE
FLD,Fold Holdings, Inc. Class A Common Stock,NASDAQ,TRUE,FALSE,TRUE
ATIIW,Archimedes Tech SPAC Partners II Co. Warrant,NASDAQ,TRUE,FALSE,TRUE
ATLC,Atlanticus Holdings Corporation Common Stock,NASDAQ,TRUE,TRUE,TRUE
NOTE.WS,FiscalNote Holdings, Inc. Warrants to purchase one share of Class A common stock, each at an exercise price of $11.50 per share,NYSE,TRUE,FALSE,TRUE
NOTE,FiscalNote Holdings, Inc.,NYSE,TRUE,FALSE,TRUE
ALCYU,Alchemy Investments Acquisition Corp 1 Units,NASDAQ,TRUE,FALSE,TRUE
ATIIU,Archimedes Tech SPAC Partners II Co. Unit,NASDAQ,TRUE,FALSE,TRUE
NOM,Nuveen Missouri Quality Municipal Income Fund,NYSE,TRUE,FALSE,TRUE
NOEMW,CO2 Energy Transition Corp. Warrant,NASDAQ,TRUE,FALSE,TRUE
NOEMU,CO2 Energy Transition Corp. Unit,NASDAQ,TRUE,FALSE,TRUE
NOEMR,CO2 Energy Transition Corp. Right,NASDAQ,TRUE,FALSE,TRUE
NOEM,CO2 Energy Transition Corp. Common Stock,NASDAQ,TRUE,FALSE,TRUE
ATMCU,AlphaTime Acquisition Corp Unit,NASDAQ,TRUE,FALSE,TRUE
ATH.PRB,Athene Holding Ltd. Depositary Shares, Each Representing a 1/1,000th Interest in a 5.625% Fixed Rate Perpetual Non- Cumulative Preference Share, Series B, par value $1.00 per share,NYSE,TRUE,TRUE,TRUE
NNY,Nuveen New York Municipal Value Fund,NYSE,TRUE,FALSE,TRUE
ASYS,Amtech Systems, Inc. Common Stock,NASDAQ,TRUE,TRUE,TRUE
DFGX,Dimensional ETF Trust Dimensional Global ex US Core Fixed Income ETF,NASDAQ,TRUE,FALSE,TRUE
NNOX,NANO-X IMAGING LTD Ordinary Shares,NASDAQ,TRUE,FALSE,TRUE
EEFT,Euronet Worldwide, Inc. Common Stock,NASDAQ,TRUE,TRUE,TRUE
NNNN,Anbio Biotechnology Class A Ordinary Shares,NASDAQ,TRUE,FALSE,TRUE
EE,Excelerate Energy, Inc.,NYSE,TRUE,TRUE,TRUE
NNE,Nano Nuclear Energy Inc. Common Stock,NASDAQ,TRUE,FALSE,TRUE
NNAVW,NextNav Inc. Warrant,NASDAQ,TRUE,FALSE,TRUE
ARTW,Art's-Way Manufacturing Co., Inc. Common Stock,NASDAQ,TRUE,TRUE,TRUE
BAYAR,Bayview Acquisition Corp Right,NASDAQ,TRUE,FALSE,TRUE
NMZ,Nuveen Municipal High Income Opportunity Fund,NYSE,TRUE,FALSE,TRUE
ATII,Archimedes Tech SPAC Partners II Co. Ordinary Shares,NASDAQ,TRUE,FALSE,TRUE
ARTNA,Artesian Resources Corporation Class A Common Stock,NASDAQ,TRUE,TRUE,TRUE
EDU,New Oriental Education and Technology Group, Inc. American Depositary Shares (each representing ten (10) Common Shares),NYSE,TRUE,TRUE,TRUE
EDIT,Editas Medicine, Inc. Common Stock,NASDAQ,TRUE,TRUE,TRUE
NMTC,NeuroOne Medical Technologies Corporation Common Stock,NASDAQ,TRUE,FALSE,TRUE
ATHS,Athene Holding Ltd. 7.250% Fixed-Rate Reset Junior Subordinated Debentures due 2064,NYSE,TRUE,FALSE,TRUE
NMT,Nuveen Massachusetts Quality Municipal Income Fund,NYSE,TRUE,FALSE,TRUE
BMEA,Biomea Fusion, Inc. Common Stock,NASDAQ,TRUE,FALSE,TRUE
NMS,Nuveen Minnesota Quality Municipal Income Fund,NYSE,TRUE,FALSE,TRUE
NMRA,Neumora Therapeutics, Inc. Common Stock,NASDAQ,TRUE,FALSE,TRUE
BMDL,Victory Portfolios II VictoryShares WestEnd Economic Cycle Bond ETF,NASDAQ,TRUE,FALSE,TRUE
ED,Consolidated Edison, Inc.,NYSE,TRUE,TRUE,TRUE
APO.PRA,Apollo Global Management, Inc. 6.75% Series A Mandatory Convertible Preferred Stock,NYSE,TRUE,TRUE,TRUE
ECVT,Ecovyst Inc.,NYSE,TRUE,TRUE,TRUE
ECPG,Encore Capital Group Inc Common Stock,NASDAQ,TRUE,TRUE,TRUE
ECOR,electroCore, Inc. Common Stock,NASDAQ,TRUE,TRUE,TRUE
NMCO,Nuveen Municipal Credit Opportunities Fund,NYSE,TRUE,FALSE,TRUE
ECL,Ecolab, Inc.,NYSE,TRUE,TRUE,TRUE
NLY.PRI,Annaly Capital Management, Inc. 6.750% Series I Fixed-to-Floating Rate Cumulative Redeemable Preferred Stock,NYSE,TRUE,FALSE,TRUE
AHL.PRE,Aspen Insurance Holdings Limited Depositary Shares, each representing a 1/1000th interest in a share of 5.625% Perpetual Non-Cumulative Preference Shares,NYSE,TRUE,TRUE,TRUE
CLNNW,Clene Inc. Warrant,NASDAQ,TRUE,FALSE,TRUE
NLY.PRG,Annaly Capital Management, Inc. 6.50% Series G Fixed-to-Floating Rate Cumulative Redeemable Preferred Stock,NYSE,TRUE,FALSE,TRUE
ECG,Everus Construction Group, Inc.,NYSE,TRUE,TRUE,TRUE
ECC,EAGLE POINT CREDIT COMPANY INC.,NYSE,TRUE,TRUE,TRUE
NLY.PRF,Annaly Capital Management, Inc. 6.95% Series F Fixed-to-Floating Rate Cumulative Redeemable Preferred Stock,NYSE,TRUE,FALSE,TRUE
EBS,Emergent Biosolutions, Inc.,NYSE,TRUE,TRUE,TRUE
NLSPW,NLS Pharmaceutics Ltd. Warrant,NASDAQ,TRUE,FALSE,TRUE
NLSP,NLS Pharmaceutics Ltd. Ordinary Shares,NASDAQ,TRUE,FALSE,TRUE
AGRO,ADECOAGRO S.A.,NYSE,TRUE,TRUE,TRUE
ADAG,Adagene Inc. American Depositary Shares,NASDAQ,TRUE,FALSE,TRUE
EBR.B,Centrais Eletricas Brasileiras S.A.- Eletrobras American Depositary Shares (Each representing one Preferred Share),NYSE,TRUE,TRUE,TRUE
NKX,Nuveen California AMT-Free Quality Municipal Income Fund,NYSE,TRUE,FALSE,TRUE
EBR,Centrais Eletricas Brasileiras S.A.- Eletrobras American Depositary Shares (Each representing one Common Share),NYSE,TRUE,TRUE,TRUE
ALTG.PRA,Alta Equipment Group Inc. Depositary Shares (each representing 1/1000th in a share of 10% Series A Cumulative Perpetual Preferred Stock),NYSE,TRUE,FALSE,TRUE
NKTR,Nektar Therapeutics Common Stock,NASDAQ,TRUE,FALSE,TRUE
EBMT,Eagle Bancorp Montana, Inc. Common Stock,NASDAQ,TRUE,TRUE,TRUE
BLUE,bluebird bio, Inc. Common Stock,NASDAQ,TRUE,FALSE,TRUE
MLECW,Moolec Science SA Warrant,NASDAQ,TRUE,FALSE,TRUE
EBF,Ennis, Inc.,NYSE,TRUE,TRUE,TRUE
AGM,Federal Agricultural Mortgage Corporation,NYSE,TRUE,TRUE,TRUE
BLRX,BioLineRx Ltd. American Depositary Shares,NASDAQ,TRUE,FALSE,TRUE
BLNK,Blink Charging Co. Common Stock,NASDAQ,TRUE,FALSE,TRUE
EBC,Eastern Bankshares, Inc. Common Stock,NASDAQ,TRUE,TRUE,TRUE
EBAY,eBay Inc. Common Stock,NASDAQ,TRUE,TRUE,TRUE
BLNE,Beeline Holdings, Inc. Common Stock,NASDAQ,TRUE,FALSE,TRUE
EAT,Brinker International, Inc.,NYSE,TRUE,TRUE,TRUE
EAF,GrafTech International Ltd.,NYSE,TRUE,TRUE,TRUE
DEVS,DevvStream Corp. Common Stock,NASDAQ,TRUE,FALSE,TRUE
NIXX,Nixxy, Inc. Common Stock,NASDAQ,TRUE,FALSE,TRUE
ONFOW,Onfolio Holdings Inc. Warrant,NASDAQ,TRUE,FALSE,TRUE
NIXT,EA Series Trust Research Affiliates Deletions ETF,NASDAQ,TRUE,FALSE,TRUE
NIVFW,NewGenIvf Group Limited Warrants,NASDAQ,TRUE,FALSE,TRUE
NIVF,NewGenIvf Group Limited Class A Ordinary Shares,NASDAQ,TRUE,FALSE,TRUE
AESI,Atlas Energy Solutions Inc.,NYSE,TRUE,TRUE,TRUE
NITO,N2OFF, Inc. Common Stock,NASDAQ,TRUE,FALSE,TRUE
BLMZ,BloomZ Inc. Ordinary Shares,NASDAQ,TRUE,FALSE,TRUE
EA,Electronic Arts Inc. Common Stock,NASDAQ,TRUE,TRUE,TRUE
ALMU,Aeluma, Inc. Common Stock,NASDAQ,TRUE,FALSE,TRUE
BLIV,BeLive Holdings Ordinary Share,NASDAQ,TRUE,FALSE,TRUE
DEMZ,The Advisors' Inner Circle Fund III Democratic Large Cap Core ETF,NASDAQ,TRUE,FALSE,TRUE
NISN,NiSun International Enterprise Development Group Co., Ltd. Class A Common Shares,NASDAQ,TRUE,FALSE,TRUE
ATHR,Aether Holdings, Inc. Common Stock,NASDAQ,TRUE,FALSE,TRUE
